JPS1917|Exodus 4:18-4:31|seq6,Exodus 4:18-4:31,Shemot,"And Moses went and returned to Jethro his father-in-law, and said unto him: ‘Let me go, I pray thee, and unto my brethren that are in Egypt, and see whether they be yet alive.’ And Jethro said to Moses: ‘Go in peace.’
And the LORD said unto Moses in Midian: ‘Go, return into Egypt; for all the men are dead that sought thy life.’
And Moses took his wife and his sons, and set them upon an ass, and he returned to the land of Egypt; and Moses took the rod of God in his hand.
And the LORD said unto Moses: ‘When thou goest back into Egypt, see that thou do before Pharaoh all the wonders which I have put in thy hand; but I will harden his heart, and he will not let the people go.
And thou shalt say unto Pharaoh: Thus saith the LORD: Israel is My son, My first-born.
And I have said unto thee: Let My son go, that he may serve Me; and thou hast refused to let him go. ‘Behold, I will slay thy first-born.’
And it came to pass on the way at the lodging-place, that the LORD met him, and sought to kill him.
Then Zipporah took a flint, and cut off the foreskin of her son, and cast it at his feet; and she said: ‘Surely a bridegroom of blood art thou to me.’
So He let him alone. Then she said: ‘A bridegroom of blood in regard of the circumcision.’
And the LORD said to Aaron: ‘Go into the wilderness to meet Moses.’ And he went, and met him in the mountain of God, and kissed him.
And Moses told Aaron all the words of the LORD wherewith He had sent him, and all the signs wherewith He had charged him.
And Moses and Aaron went and gathered together all the elders of the children of Israel.
And Aaron spoke all the words which the LORD had spoken unto Moses, and did the signs in the sight of the people.
And the people believed; and when they heard that the LORD had remembered the children of Israel, and that He had seen their affliction, then they bowed their heads and worshipped.",Torah::Exodus::Shemot Type::Sequence Aliyah::6
JPS1917|Exodus 5:1-6:1|seq7,Exodus 5:1-6:1,Shemot,"And afterward Moses and Aaron came, and said unto Pharaoh: ‘Thus saith the LORD, the God of Israel: Let My people go, that they may hold a feast unto Me in the wilderness.’
And Pharaoh said: ‘Who is the LORD, that I should hearken unto His voice to let Israel go? I know not the LORD, and moreover I will not let Israel go.’
And they said: ‘The God of the Hebrews hath met with us. Let us go, we pray thee, three days’journey into the wilderness, and sacrifice unto the LORD our God; lest He fall upon us with pestilence, or with the sword.’
And the king of Egypt said unto them: ‘Wherefore do ye, Moses and Aaron, cause the people to break loose from their work? get you unto your burdens.’
And Pharaoh said: ‘Behold, the people of the land are now many, and will ye make them rest from their burdens?’
And the same day Pharaoh commanded the taskmasters of the people, and their officers, saying:
’Ye shall no more give the people straw to make brick, as heretofore. Let them go and gather straw for themselves.
And the tale of the bricks, which they did make heretofore, ye shall lay upon them; ye shall not diminish aught thereof; for they are idle; therefore they cry, saying: Let us go and sacrifice to our God.
Let heavier work be laid upon the men, that they may labour therein; and let them not regard lying words.’
And the taskmasters of the people went out, and their officers, and they spoke to the people, saying: ‘Thus saith Pharaoh: I will not give you straw.
Go yourselves, get you straw where ye can find it; for nought of your work shall be diminished.’
So the people were scattered abroad throughout all the land of Egypt to gather stubble for straw.
And the taskmasters were urgent, saying: ‘Fulfil your work, your daily task, as when there was straw.’
And the officers of the children of Israel, whom Pharaoh’s taskmasters had set over them, were beaten, saying: ‘Wherefore have ye not fulfilled your appointed task in making brick both yesterday and today as heretofore?’
Then the officers of the children of Israel came and cried unto Pharaoh, saying: ‘Wherefore dealest thou thus with thy servants?
There is no straw given unto thy servants, and they say to us: Make brick; and, behold, thy servants are beaten, but the fault is in thine own people.’
But he said: ‘Ye are idle, ye are idle; therefore ye say: Let us go and sacrifice to the LORD.
Go therefore now, and work; for there shall no straw be given you, yet shall ye deliver the tale of bricks.’
And the officers of the children of Israel did see that they were set on mischief, when they said: ‘Ye shall not diminish aught from your bricks, your daily task.’
And they met Moses and Aaron, who stood in the way, as they came forth from Pharaoh;
and they said unto them: ‘The LORD look upon you, and judge; because ye have made our savour to be abhorred in the eyes of Pharaoh, and in the eyes of his servants, to put a sword in their hand to slay us.’
And Moses returned unto the LORD, and said: ‘Lord, wherefore hast Thou dealt ill with this people? why is it that Thou hast sent me?
For since I came to Pharaoh to speak in Thy name, he hath dealt ill with this people; neither hast Thou delivered Thy people at all.’
And the LORD said unto Moses: ‘Now shalt thou see what I will do to Pharaoh; for by a strong hand shall he let them go, and by a strong hand shall he drive them out of his land.’",Torah::Exodus::Shemot Type::Sequence Aliyah::7
JPS1917|Exodus 6:2-6:13|seq1,Exodus 6:2-6:13,Vaera,"And God spoke unto Moses, and said unto him: ‘I am the LORD;
and I appeared unto Abraham, unto Isaac, and unto Jacob, as God Almighty, but by My name יהוה I made Me not known to them.
And I have also established My covenant with them, to give them the land of Canaan, the land of their sojournings, wherein they sojourned.
And moreover I have heard the groaning of the children of Israel, whom the Egyptians keep in bondage; and I have remembered My covenant.
Wherefore say unto the children of Israel: I am the LORD, and I will bring you out from under the burdens of the Egyptians, and I will deliver you from their bondage, and I will redeem you with an outstretched arm, and with great judgments;
and I will take you to Me for a people, and I will be to you a God; and ye shall know that I am the LORD your God, who brought you out from under the burdens of the Egyptians.
And I will bring you in unto the land, concerning which I lifted up My hand to give it to Abraham, to Isaac, and to Jacob; and I will give it you for a heritage: I am the LORD.’
And Moses spoke so unto the children of Israel; but they hearkened not unto Moses for impatience of spirit, and for cruel bondage.
And the LORD spoke unto Moses, saying:
’Go in, speak unto Pharaoh king of Egypt, that he let the children of Israel go out of his land.’
And Moses spoke before the LORD, saying: ‘Behold, the children of Israel have not hearkened unto me; how then shall Pharaoh hear me, who am of uncircumcised lips?’
And the LORD spoke unto Moses and unto Aaron, and gave them a charge unto the children of Israel, and unto Pharaoh king of Egypt, to bring the children of Israel out of the land of Egypt.",Torah::Exodus::Vaera Type::Sequence Aliyah::1
JPS1917|Exodus 6:14-6:28|seq2,Exodus 6:14-6:28,Vaera,"These are the heads of their fathers’houses: the sons of Reuben the first-born of Israel: Hanoch, and Pallu, Hezron, and Carmi. These are the families of Reuben.
And the sons of Simeon: Jemuel, and Jamin, and Ohad, and Jachin, and Zohar, and Shaul the son of a Canaanitish woman. These are the families of Simeon.
And these are the names of the sons of Levi according to their generations: Gershon and Kohath, and Merari. And the years of the life of Levi were a hundred thirty and seven years.
The sons of Gershon: Libni and Shimei, according to their families.
And the sons of Kohath: Amram, and Izhar, and Hebron, and Uzziel. And the years of the life of Kohath were a hundred thirty and three years.
And the sons of Merari: Mahli and Mushi. These are the families of the Levites according to their generations.
And Amram took him Jochebed his father’s sister to wife; and she bore him Aaron and Moses. And the years of the life of Amram were a hundred and thirty and seven years.
And the sons of Izhar: Korah, and Nepheg, and Zichri.
And the sons of Uzziel: Mishael, and Elzaphan, and Sithri.
And Aaron took him Elisheba, the daughter of Amminadab, the sister of Nahshon, to wife; and she bore him Nadab and Abihu, Eleazar and Ithamar.
And the sons of Korah: Assir, and Elkanah, and Abiasaph; these are the families of the Korahites.
And Eleazar Aaron’s son took him one of the daughters of Putiel to wife; and she bore him Phinehas. These are the heads of the fathers’houses of the Levites according to their families.
These are that Aaron and Moses, to whom the LORD said: ‘Bring out the children of Israel from the land of Egypt according to their hosts.’
These are they that spoke to Pharaoh king of Egypt, to bring out the children of Israel from Egypt. These are that Moses and Aaron.
And it came to pass on the day when the LORD spoke unto Moses in the land of Egypt,",Torah::Exodus::Vaera Type::Sequence Aliyah::2
JPS1917|Exodus 6:29-7:7|seq3,Exodus 6:29-7:7,Vaera,"that the LORD spoke unto Moses, saying: ‘I am the LORD; speak thou unto Pharaoh king of Egypt all that I speak unto thee.’
And Moses said before the LORD: ‘Behold, I am of uncircumcised lips, and how shall Pharaoh hearken unto me?’
And the LORD said unto Moses: ‘See, I have set thee in God’s stead to Pharaoh; and Aaron thy brother shall be thy prophet.
Thou shalt speak all that I command thee; and Aaron thy brother shall speak unto Pharaoh, that he let the children of Israel go out of his land.
And I will harden Pharaoh’s heart, and multiply My signs and My wonders in the land of Egypt.
But Pharaoh will not hearken unto you, and I will lay My hand upon Egypt, and bring forth My hosts, My people the children of Israel, out of the land of Egypt, by great judgments.
And the Egyptians shall know that I am the LORD, when I stretch forth My hand upon Egypt, and bring out the children of Israel from among them.’
And Moses and Aaron did so; as the LORD commanded them, so did they.
And Moses was fourscore years old, and Aaron fourscore and three years old, when they spoke unto Pharaoh.",Torah::Exodus::Vaera Type::Sequence Aliyah::3
JPS1917|Exodus 7:8-8:6|seq4,Exodus 7:8-8:6,Vaera,"And the LORD spoke unto Moses and unto Aaron, saying:
’When Pharaoh shall speak unto you, saying: Show a wonder for you; then thou shalt say unto Aaron: Take thy rod, and cast it down before Pharaoh, that it become a serpent.’
And Moses and Aaron went in unto Pharaoh, and they did so, as the LORD had commanded; and Aaron cast down his rod before Pharaoh and before his servants, and it became a serpent.
Then Pharaoh also called for the wise men and the sorcerers; and they also, the magicians of Egypt, did in like manner with their secret arts.
For they cast down every man his rod, and they became serpents; but Aaron’s rod swallowed up their rods.
And Pharaoh’s heart was hardened, and he hearkened not unto them; as the LORD had spoken.
And the LORD said unto Moses: ‘Pharaoh’s heart is stubborn, he refuseth to let the people go.
Get thee unto Pharaoh in the morning; lo, he goeth out unto the water; and thou shalt stand by the river’s brink to meet him; and the rod which was turned to a serpent shalt thou take in thy hand.
And thou shalt say unto him: The LORD, the God of the Hebrews, hath sent me unto thee, saying: Let My people go, that they may serve Me in the wilderness; and, behold, hitherto thou hast not hearkened;
thus saith the LORD: In this thou shalt know that I am the LORD—behold, I will smite with the rod that is in my hand upon the waters which are in the river, and they shall be turned to blood.
And the fish that are in the river shall die, and the river shall become foul; and the Egyptians shall loathe to drink water from the river.’
And the LORD said unto Moses: ‘Say unto Aaron: Take thy rod, and stretch out thy hand over the waters of Egypt, over their rivers, over their streams, and over their pools, and over all their ponds of water, that they may become blood; and there shall be blood throughout all the land of Egypt, both in vessels of wood and in vessels of stone.’
And Moses and Aaron did so, as the LORD commanded; and he lifted up the rod, and smote the waters that were in the river, in the sight of Pharaoh, and in the sight of his servants; and all the waters that were in the river were turned to blood.
And the fish that were in the river died; and the river became foul, and the Egyptians could not drink water from the river; and the blood was throughout all the land of Egypt.
And the magicians of Egypt did in like manner with their secret arts; and Pharaoh’s heart was hardened, and he hearkened not unto them; as the LORD had spoken.
And Pharaoh turned and went into his house, neither did he lay even this to heart.
And all the Egyptians digged round about the river for water to drink; for they could not drink of the water of the river.
And seven days were fulfilled, after that the LORD had smitten the river.
And the LORD spoke unto Moses: ‘Go in unto Pharaoh, and say unto him: Thus saith the LORD: Let My people go, that they may serve Me.
And if thou refuse to let them go, behold, I will smite all thy borders with frogs.
And the river shall swarm with frogs, which shall go up and come into thy house, and into thy bed-chamber, and upon thy bed, and into the house of thy servants, and upon thy people, and into thine ovens, and into thy kneading-troughs.
And the frogs shall come up both upon thee, and upon thy people, and upon all thy servants.’
And the LORD said unto Moses: ‘Say unto Aaron: Stretch forth thy hand with thy rod over the rivers, over the canals, and over the pools, and cause frogs to come up upon the land of Egypt.’
And Aaron stretched out his hand over the waters of Egypt; and the frogs came up, and covered the land of Egypt.
And the magicians did in like manner with their secret arts, and brought up frogs upon the land of Egypt.
Then Pharaoh called for Moses and Aaron, and said: ‘Entreat the LORD, that He take away the frogs from me, and from my people; and I will let the people go, that they may sacrifice unto the LORD.’
And Moses said unto Pharaoh: ‘Have thou this glory over me; against what time shall I entreat for thee, and for thy servants, and for thy people, that the frogs be destroyed from thee and thy houses, and remain in the river only?’
And he said: ‘Against to-morrow.’ And he said: ‘Be it according to thy word; that thou mayest know that there is none like unto the LORD our God.",Torah::Exodus::Vaera Type::Sequence Aliyah::4
JPS1917|Exodus 8:7-8:18|seq5,Exodus 8:7-8:18,Vaera,"And the frogs shall depart from thee, and from thy houses, and from thy servants, and from thy people; they shall remain in the river only.’
And Moses and Aaron went out from Pharaoh; and Moses cried unto the LORD concerning the frogs, which He had brought upon Pharaoh.
And the LORD did according to the word of Moses; and the frogs died out of the houses, out of the courts, and out of the fields.
And they gathered them together in heaps; and the land stank.
But when Pharaoh saw that there was respite, he hardened his heart, and hearkened not unto them; as the LORD had spoken.
And the LORD said unto Moses: ‘Say unto Aaron: Stretch out thy rod, and smite the dust of the earth, that it may become gnats throughout all the land of Egypt.’
And they did so; and Aaron stretched out his hand with his rod, and smote the dust of the earth, and there were gnats upon man, and upon beast; all the dust of the earth became gnats throughout all the land of Egypt.
And the magicians did so with their secret arts to bring forth gnats, but they could not; and there were gnats upon man, and upon beast.
Then the magicians said unto Pharaoh: ‘This is the finger of God’; and Pharaoh’s heart was hardened, and he hearkened not unto them; as the LORD had spoken.
And the LORD said unto Moses: ‘Rise up early in the morning, and stand before Pharaoh; lo, he cometh forth to the water; and say unto him: Thus saith the LORD: Let My people go, that they may serve Me.
Else, if thou wilt not let My people go, behold, I will send swarms of flies upon thee, and upon thy servants, and upon thy people, and into thy houses; and the houses of the Egyptians shall be full of swarms of flies, and also the ground whereon they are.
And I will set apart in that day the land of Goshen, in which My people dwell, that no swarms of flies shall be there; to the end that thou mayest know that I am the LORD in the midst of the earth.",Torah::Exodus::Vaera Type::Sequence Aliyah::5
JPS1917|Exodus 8:19-9:16|seq6,Exodus 8:19-9:16,Vaera,"And I will put a division between My people and thy people—by to-morrow shall this sign be.’
And the LORD did so; and there came grievous swarms of flies into the house of Pharaoh, and into his servants’houses; and in all the land of Egypt the land was ruined by reason of the swarms of flies.
And Pharaoh called for Moses and for Aaron, and said: ‘Go ye, sacrifice to your God in the land.’
And Moses said: ‘It is not meet so to do; for we shall sacrifice the abomination of the Egyptians to the LORD our God; lo, if we sacrifice the abomination of the Egyptians before their eyes, will they not stone us?
We will go three days’journey into the wilderness, and sacrifice to the LORD our God, as He shall command us.’
And Pharaoh said: ‘I will let you go, that ye may sacrifice to the LORD your God in the wilderness; only ye shall not go very far away; entreat for me.’
And Moses said: ‘Behold, I go out from thee, and I will entreat the LORD that the swarms of flies may depart from Pharaoh, from his servants, and from his people, tomorrow; only let not Pharaoh deal deceitfully any more in not letting the people go to sacrifice to the LORD.’
And Moses went out from Pharaoh, and entreated the LORD.
And the LORD did according to the word of Moses; and He removed the swarms of flies from Pharaoh, from his servants, and from his people; there remained not one.
And Pharaoh hardened his heart this time also, and he did not let the people go.
Then the LORD said unto Moses: ‘Go in unto Pharaoh, and tell him: Thus saith the LORD, the God of the Hebrews: Let My people go, that they may serve Me.
For if thou refuse to let them go, and wilt hold them still,
behold, the hand of the LORD is upon thy cattle which are in the field, upon the horses, upon the asses, upon the camels, upon the herds, and upon the flocks; there shall be a very grievous murrain.
And the LORD shall make a division between the cattle of Israel and the cattle of Egypt; and there shall nothing die of all that belongeth to the children of Israel.’
And the LORD appointed a set time, saying: ‘Tomorrow the LORD shall do this thing in the land.’
And the LORD did that thing on the morrow, and all the cattle of Egypt died; but of the cattle of the children of Israel died not one.
And Pharaoh sent, and, behold, there was not so much as one of the cattle of the Israelites dead. But the heart of Pharaoh was stubborn, and he did not let the people go.
And the LORD said unto Moses and unto Aaron: ‘Take to you handfuls of soot of the furnace, and let Moses throw it heavenward in the sight of Pharaoh.
And it shall become small dust over all the land of Egypt, and shall be a boil breaking forth with blains upon man and upon beast, throughout all the land of Egypt.’
And they took soot of the furnace, and stood before Pharaoh; and Moses threw it up heavenward; and it became a boil breaking forth with blains upon man and upon beast.
And the magicians could not stand before Moses because of the boils; for the boils were upon the magicians, and upon all the Egyptians.
And the LORD hardened the heart of Pharaoh, and he hearkened not unto them; as the LORD had spoken unto Moses.
And the LORD said unto Moses: ‘Rise up early in the morning, and stand before Pharaoh, and say unto him: Thus saith the LORD, the God of the Hebrews: Let My people go, that they may serve Me.
For I will this time send all My plagues upon thy person, and upon thy servants, and upon thy people; that thou mayest know that there is none like Me in all the earth.
Surely now I had put forth My hand, and smitten thee and thy people with pestilence, and thou hadst been cut off from the earth.
But in very deed for this cause have I made thee to stand, to show thee My power, and that My name may be declared throughout all the earth.",Torah::Exodus::Vaera Type::Sequence Aliyah::6
JPS1917|Exodus 9:17-9:35|seq7,Exodus 9:17-9:35,Vaera,"As yet exaltest thou thyself against My people, that thou wilt not let them go?
Behold, tomorrow about this time I will cause it to rain a very grievous hail, such as hath not been in Egypt since the day it was founded even until now.
Now therefore send, hasten in thy cattle and all that thou hast in the field; for every man and beast that shall be found in the field, and shall not be brought home, the hail shall come down upon them, and they shall die.’
He that feared the word of the LORD among the servants of Pharaoh made his servants and his cattle flee into the houses;
and he that regarded not the word of the LORD left his servants and his cattle in the field.
And the LORD said unto Moses: ‘Stretch forth thy hand toward heaven, that there may be hail in all the land of Egypt, upon man, and upon beast, and upon every herb of the field, throughout the land of Egypt.’
And Moses stretched forth his rod toward heaven; and the LORD sent thunder and hail, and fire ran down unto the earth; and the LORD caused to hail upon the land of Egypt.
So there was hail, and fire flashing up amidst the hail, very grievous, such as had not been in all the land of Egypt since it became a nation.
And the hail smote throughout all the land of Egypt all that was in the field, both man and beast; and the hail smote every herb of the field, and broke every tree of the field.
Only in the land of Goshen, where the children of Israel were, was there no hail.
And Pharaoh sent, and called for Moses and Aaron, and said unto them: ‘I have sinned this time; the LORD is righteous, and I and my people are wicked.
Entreat the LORD, and let there be enough of these mighty thunderings and hail; and I will let you go, and ye shall stay no longer.’
And Moses said unto him: ‘As soon as I am gone out of the city, I will spread forth my hands unto the LORD; the thunders shall cease, neither shall there be any more hail; that thou mayest know that the earth is the LORD’s.
But as for thee and thy servants, I know that ye will not yet fear the LORD God.’—
And the flax and the barley were smitten; for the barley was in the ear, and the flax was in bloom.
But the wheat and the spelt were not smitten; for they ripen late.—
And Moses went out of the city from Pharaoh, and spread forth his hands unto the LORD; and the thunders and hail ceased, and the rain was not poured upon the earth.
And when Pharaoh saw that the rain and the hail and the thunders were ceased, he sinned yet more, and hardened his heart, he and his servants.
And the heart of Pharaoh was hardened, and he did not let the children of Israel go; as the LORD had spoken by Moses.",Torah::Exodus::Vaera Type::Sequence Aliyah::7
JPS1917|Exodus 10:1-10:11|seq1,Exodus 10:1-10:11,Bo,"And the LORD said unto Moses: ‘Go in unto Pharaoh; for I have hardened his heart, and the heart of his servants, that I might show these My signs in the midst of them;
and that thou mayest tell in the ears of thy son, and of thy son’s son, what I have wrought upon Egypt, and My signs which I have done among them; that ye may know that I am the LORD.’
And Moses and Aaron went in unto Pharaoh, and said unto him: ‘Thus saith the LORD, the God of the Hebrews: How long wilt thou refuse to humble thyself before Me? let My people go, that they may serve Me.
Else, if thou refuse to let My people go, behold, to-morrow will I bring locusts into thy border;
and they shall cover the face of the earth, that one shall not be able to see the earth; and they shall eat the residue of that which is escaped, which remaineth unto you from the hail, and shall eat every tree which groweth for you out of the field;
and thy houses shall be filled, and the houses of all thy servants, and the houses of all the Egyptians; as neither thy fathers nor thy fathers’fathers have seen, since the day that they were upon the earth unto this day.’ And he turned, and went out from Pharaoh.
And Pharaoh’s servants said unto him: ‘How long shall this man be a snare unto us? let the men go, that they may serve the LORD their God, knowest thou not yet that Egypt is destroyed?’
And Moses and Aaron were brought again unto Pharaoh; and he said unto them: ‘Go, serve the LORD your God; but who are they that shall go?’
And Moses said: ‘We will go with our young and with our old, with our sons and with our daughters, with our flocks and with our herds we will go; for we must hold a feast unto the LORD.’
And he said unto them: ‘So be the LORD with you, as I will let you go, and your little ones; see ye that evil is before your face.
Not so; go now ye that are men, and serve the LORD; for that is what ye desire.’ And they were driven out from Pharaoh’s presence.",Torah::Exodus::Bo Type::Sequence Aliyah::1
