JPS1917|Numbers 22:21-22:38|seq3,Numbers 22:21-22:38,Balak,"And Balaam rose up in the morning, and saddled his ass, and went with the princes of Moab.
And God’s anger was kindled because he went; and the angel of the LORD placed himself in the way for an adversary against him.—Now he was riding upon his ass, and his two servants were with him.—
And the ass saw the angel of the LORD standing in the way, with his sword drawn in his hand; and the ass turned aside out of the way, and went into the field; and Balaam smote the ass, to turn her into the way.
Then the angel of the LORD stood in a hollow way between the vineyards, a fence being on this side, and a fence on that side.
And the ass saw the angel of the LORD, and she thrust herself unto the wall, and crushed Balaam’s foot against the wall; and he smote her again.
And the angel of the LORD went further, and stood in a narrow place, where was no way to turn either to the right hand or to the left.
And the ass saw the angel of the LORD, and she lay down under Balaam; and Balaam’s anger was kindled, and he smote the ass with his staff.
And the LORD opened the mouth of the ass, and she said unto Balaam: ‘What have I done unto thee, that thou hast smitten me these three times?’
And Balaam said unto the ass: ‘Because thou hast mocked me; I would there were a sword in my hand, for now I had killed thee.’
And the ass said unto Balaam: ‘Am not I thine ass, upon which thou hast ridden all thy life long unto this day? was I ever wont to do so unto thee?’ And he said: ‘Nay.’
Then the LORD opened the eyes of Balaam, and he saw the angel of the LORD standing in the way, with his sword drawn in his hand; and he bowed his head, and fell on his face.
And the angel of the LORD said unto him: ‘Wherefore hast thou smitten thine ass these three times? behold, I am come forth for an adversary, because thy way is contrary unto me;
and the ass saw me, and turned aside before me these three times; unless she had turned aside from me, surely now I had even slain thee, and saved her alive.’
And Balaam said unto the angel of the LORD: ‘I have sinned; for I knew not that thou stoodest in the way against me; now therefore, if it displease thee, I will get me back.’
And the angel of the LORD said unto Balaam: ‘Go with the men; but only the word that I shall speak unto thee, that thou shalt speak.’ So Balaam went with the princes of Balak.
And when Balak heard that Balaam was come, he went out to meet him unto Ir-moab, which is on the border of Arnon, which is in the utmost part of the border.
And Balak said unto Balaam: ‘Did I not earnestly send unto thee to call thee? wherefore camest thou not unto me? am I not able indeed to promote thee to honour?’
And Balaam said unto Balak: ‘Lo, I am come unto thee; have I now any power at all to speak any thing? the word that God putteth in my mouth, that shall I speak.’",Torah::Numbers::Balak Type::Sequence Aliyah::3
JPS1917|Numbers 22:39-23:12|seq4,Numbers 22:39-23:12,Balak,"And Balaam went with Balak, and they came unto Kiriath-huzoth.
And Balak sacrificed oxen and sheep, and sent to Balaam, and to the princes that were with him.
And it came to pass in the morning that Balak took Balaam, and brought him up into Bamoth-baal, and he saw from thence the utmost part of the people.
And Balaam said unto Balak: ‘Build me here seven altars, and prepare me here seven bullocks and seven rams.’
And Balak did as Balaam had spoken; and Balak and Balaam offered on every altar a bullock and a ram.
And Balaam said unto Balak: ‘Stand by thy burnt-offering, and I will go; peradventure the LORD will come to meet me; and whatsoever He showeth me I will tell thee.’ And he went to a bare height.
And God met Balaam; and he said unto Him: ‘I have prepared the seven altars, and I have offered up a bullock and a ram on every altar.’
And the LORD put a word in Balaam’s mouth, and said: ‘Return unto Balak, and thus thou shalt speak.’
And he returned unto him, and, lo, he stood by his burnt-offering, he, and all the princes of Moab.
And he took up his parable, and said: From Aram Balak bringeth me, The king of Moab from the mountains of the East: ‘Come, curse me Jacob, And come, execrate Israel.’
How shall I curse, whom God hath not cursed? And how shall I execrate, whom the LORD hath not execrated?
For from the top of the rocks I see him, And from the hills I behold him: Lo, it is a people that shall dwell alone, And shall not be reckoned among the nations.
Who hath counted the dust of Jacob, Or numbered the stock of Israel? Let me die the death of the righteous, And let mine end be like his!
And Balak said unto Balaam: ‘What hast thou done unto me? I took thee to curse mine enemies, and, behold, thou hast blessed them altogether.’
And he answered and said: ‘Must I not take heed to speak that which the LORD putteth in my mouth?’",Torah::Numbers::Balak Type::Sequence Aliyah::4
JPS1917|Numbers 23:13-23:26|seq5,Numbers 23:13-23:26,Balak,"And Balak said unto him: ‘Come, I pray thee, with me unto another place, from whence thou mayest see them; thou shalt see but the utmost part of them, and shalt not see them all; and curse me them from thence.’
And he took him into the field of Zophim, to the top of Pisgah, and built seven altars, and offered up a bullock and a ram on every altar.
And he said unto Balak: ‘Stand here by thy burnt-offering, while I go toward a meeting yonder.’
And the LORD met Balaam, and put a word in his mouth, and said: ‘Return unto Balak, and thus shalt thou speak.’
And he came to him, and, lo, he stood by his burnt-offering, and the princes of Moab with him. And Balak said unto him: ‘What hath the LORD spoken?’
And he took up his parable, and said: Arise, Balak, and hear; Give ear unto me, thou son of Zippor:
God is not a man, that He should lie; Neither the son of man, that He should repent: When He hath said, will He not do it? Or when He hath spoken, will He not make it good?
Behold, I am bidden to bless; And when He hath blessed, I cannot call it back.
None hath beheld iniquity in Jacob, Neither hath one seen perverseness in Israel; The LORD his God is with him, And the shouting for the King is among them.
God who brought them forth out of Egypt Is for them like the lofty horns of the wild-ox.
For there is no enchantment with Jacob, Neither is there any divination with Israel; Now is it said of Jacob and of Israel: ‘What hath God wrought! ’
Behold a people that riseth up as a lioness, And as a lion doth he lift himself up; He shall not lie down until he eat of the prey, And drink the blood of the slain.
And Balak said unto Balaam: ‘Neither curse them at all, nor bless them at all.’
But Balaam answered and said unto Balak: ‘Told not I thee, saying: All that the LORD speaketh, that I must do?’",Torah::Numbers::Balak Type::Sequence Aliyah::5
JPS1917|Numbers 23:27-24:13|seq6,Numbers 23:27-24:13,Balak,"And Balak said unto Balaam: ‘Come now, I will take thee unto another place; peradventure it will please God that thou mayest curse me them from thence.’
And Balak took Balaam unto the top of Peor, that looketh down upon the desert.
And Balaam said unto Balak: ‘Build me here seven altars, and prepare me here seven bullocks and seven rams.’
And Balak did as Balaam had said, and offered up a bullock and a ram on every altar.
And when Balaam saw that it pleased the LORD to bless Israel, he went not, as at the other times, to meet with enchantments, but he set his face toward the wilderness.
And Balaam lifted up his eyes, and he saw Israel dwelling tribe by tribe; and the spirit of God came upon him.
And he took up his parable, and said: The saying of Balaam the son of Beor, And the saying of the man whose eye is opened;
The saying of him who heareth the words of God, Who seeth the vision of the Almighty, Fallen down, yet with opened eyes:
How goodly are thy tents, O Jacob, Thy dwellings, O Israel!
As valleys stretched out, As gardens by the river-side; As aloes planted of the LORD, As cedars beside the waters;
Water shall flow from his branches, And his seed shall be in many waters; And his king shall be higher than Agag, And his kingdom shall be exalted.
God who brought him forth out of Egypt Is for him like the lofty horns of the wild-ox; He shall eat up the nations that are his adversaries, And shall break their bones in pieces, And pierce them through with his arrows.
He couched, he lay down as a lion, And as a lioness; who shall rouse him up? Blessed be every one that blesseth thee, And cursed be every one that curseth thee.
And Balak’s anger was kindled against Balaam, and he smote his hands together; and Balak said unto Balaam: ‘I called thee to curse mine enemies, and, behold, thou hast altogether blessed them these three times.
Therefore now flee thou to thy place; I thought to promote thee unto great honour; but, lo, the LORD hath kept thee back from honour.’
And Balaam said unto Balak: ‘Spoke I not also to thy messengers that thou didst send unto me, saying:
If Balak would give me his house full of silver and gold, I cannot go beyond the word of the LORD, to do either good or bad of mine own mind; what the LORD speaketh, that will I speak?",Torah::Numbers::Balak Type::Sequence Aliyah::6
JPS1917|Numbers 24:14-25:9|seq7,Numbers 24:14-25:9,Balak,"And now, behold, I go unto my people; come, and I will announce to thee what this people shall do to thy people in the end of days.’
And he took up his parable, and said: The saying of Balaam the son of Beor, And the saying of the man whose eye is opened;
The saying of him who heareth the words of God, And knoweth the knowledge of the Most High, Who seeth the vision of the Almighty, Fallen down, yet with opened eyes:
I see him, but not now; I behold him, but not nigh; There shall step forth a star out of Jacob, And a scepter shall rise out of Israel, And shall smite through the corners of Moab, And break down all the sons of Seth.
And Edom shall be a possession, Seir also, even his enemies, shall be a possession; While Israel doeth valiantly.
And out of Jacob shall one have dominion, And shall destroy the remnant from the city.
And he looked on Amalek, and took up his parable, and said: Amalek was the first of the nations; But his end shall come to destruction.
And he looked on the Kenite, and took up his parable, and said: Though firm be thy dwelling-place, And though thy nest be set in the rock;
Nevertheless Kain shall be wasted; How long? Asshur shall carry thee away captive. .
And he took up his parable, and said: Alas, who shall live after God hath appointed him?
But ships shall come from the coast of Kittim, And they shall afflict Asshur, and shall afflict Eber, And he also shall come to destruction.
And Balaam rose up, and went and returned to his place; and Balak also went his way.
And Israel abode in Shittim, and the people began to commit harlotry with the daughters of Moab.
And they called the people unto the sacrifices of their gods; and the people did eat, and bowed down to their gods.
And Israel joined himself unto the Baal of Peor; and the anger of the LORD was kindled against Israel.
And the LORD said unto Moses: ‘Take all the chiefs of the people, and hang them up unto the LORD in face of the sun, that the fierce anger of the LORD may turn away from Israel.’
And Moses said unto the judges of Israel: ‘Slay ye every one his men that have joined themselves unto the Baal of Peor.’
And, behold, one of the children of Israel came and brought unto his brethren a Midianitish woman in the sight of Moses, and in the sight of all the congregation of the children of Israel, while they were weeping at the door of the tent of meeting.
And when Phinehas, the son of Eleazar, the son of Aaron the priest, saw it, he rose up from the midst of the congregation, and took a spear in his hand.
And he went after the man of Israel into the chamber, and thrust both of them through, the man of Israel, and the woman through her belly. So the plague was stayed from the children of Israel.
And those that died by the plague were twenty and four thousand.",Torah::Numbers::Balak Type::Sequence Aliyah::7
JPS1917|Numbers 25:10-26:4|seq1,Numbers 25:10-26:4,Pinchas,"And the LORD spoke unto Moses, saying:
’Phinehas, the son of Eleazar, the son of Aaron the priest, hath turned My wrath away from the children of Israel, in that he was very jealous for My sake among them, so that I consumed not the children of Israel in My jealousy.
Wherefore say: Behold, I give unto him My covenant of peace;
and it shall be unto him, and to his seed after him, the covenant of an everlasting priesthood; because he was jealous for his God, and made atonement for the children of Israel.’
Now the name of the man of Israel that was slain, who was slain with the Midianitish woman, was Zimri, the son of Salu, a prince of a fathers’house among the Simeonites.
And the name of the Midianitish woman that was slain was Cozbi, the daughter of Zur; he was head of the people of a fathers’house in Midian.
And the LORD spoke unto Moses, saying:
’Harass the Midianites, and smite them;
for they harass you, by their wiles wherewith they have beguiled you in the matter of Peor, and in the matter of Cozbi, the daughter of the prince of Midian, their sister, who was slain on the day of the plague in the matter of Peor.’
And it came to pass after the plague, that the LORD spoke unto Moses and unto Eleazar the son of Aaron the priest, saying:
’Take the sum of all the congregation of the children of Israel, from twenty years old and upward, by their fathers’houses, all that are able to go forth to war in Israel.’
And Moses and Eleazar the priest spoke with them in the plains of Moab by the Jordan at Jericho, saying:
’[Take the sum of the people,] from twenty years old and upward, as the LORD commanded Moses and the children of Israel, that came forth out of the land of Egypt.’",Torah::Numbers::Pinchas Type::Sequence Aliyah::1
JPS1917|Numbers 26:5-26:51|seq2,Numbers 26:5-26:51,Pinchas,"Reuben, the first-born of Israel: the sons of Reuben: of Hanoch, the family of the Hanochites; of Pallu, the family of the Palluites;
of Hezron, the family of the Hezronites; of Carmi, the family of the Carmites.
These are the families of the Reubenites; and they that were numbered of them were forty and three thousand and seven hundred and thirty.
And the sons of Pallu: Eliab.
And the sons of Eliab: Nemuel, and Dathan, and Abiram. These are that Dathan and Abiram, the elect of the congregation, who strove against Moses and against Aaron in the company of Korah, when they strove against the LORD;
and the earth opened her mouth, and swallowed them up together with Korah, when that company died; what time the fire devoured two hundred and fifty men, and they became a sign.
Notwithstanding the sons of Korah died not.
The sons of Simeon after their families: of Nemuel, the family of the Nemuelites; of Jamin, the family of the Jaminites; of Jachin, the family of the Jachinites;
of Zerah, the family of the Zerahites; of Shaul, the family of the Shaulites.
These are the families of the Simeonites, twenty and two thousand and two hundred.
The sons of Gad after their families: of Zephon, the family of the Zephonites; of Haggi, the family of the Haggites; of Shuni, the family of the Shunites;
of Ozni, the family of the Oznites; of Eri, the family of the Erites;
of Arod, the family of the Arodites; of Areli, the family of the Arelites.
These are the families of the sons of Gad according to those that were numbered of them, forty thousand and five hundred.
The sons of Judah: Er and Onan; and Er and Onan died in the land of Canaan.
And the sons of Judah after their families were: of Shelah, the family of the Shelanites; of Perez, the family of the Perezites; of Zerah, the family of the Zerahites.
And the sons of Perez were: of Hezron, the family of the Hezronites; of Hamul, the family of the Hamulites.
These are the families of Judah according to those that were numbered of them, threescore and sixteen thousand and five hundred.
The sons of Issachar after their families: of Tola, the family of the Tolaites; of Puvah, the family of the Punites;
of Jashub, the family of the Jashubites; of Shimron, the family of the Shimronites.
These are the families of Issachar according to those that were numbered of them, threescore and four thousand and three hundred.
The sons of Zebulun after their families: of Sered, the family of the Seredites; of Elon, the family of the Elonites; of Jahleel, the family of the Jahleelites.
These are the families of the Zebulunites according to those that were numbered of them, threescore thousand and five hundred.
The sons of Joseph after their families: Manasseh and Ephraim.
The sons of Manasseh: of Machir, the family of the Machirites—and Machir begot Gilead; of Gilead, the family of the Gileadites.
These are the sons of Gilead: of Iezer, the family of the Iezerites; of Helek, the family of the Helekites;
and of Asriel, the family of the Asrielites; and of Shechem, the family of the Shechemites;
and of Shemida, the family of the Shemidaites; and of Hepher, the family of the Hepherites.
And Zelophehad the son of Hepher had no sons, but daughters; and the names of the daughters of Zelophehad were Mahlah, and Noah, Hoglah, Milcah, and Tirzah.
These are the families of Manasseh; and they that were numbered of them were fifty and two thousand and seven hundred.
These are the sons of Ephraim after their families: of Shuthelah, the family of the Shuthelahites; of Becher, the family of the Becherites; of Tahan, the family of the Tahanites.
And these are the sons of Shuthelah: of Eran, the family of the Eranites.
These are the families of the sons of Ephraim according to those that were numbered of them, thirty and two thousand and five hundred. These are the sons of Joseph after their families.
The sons of Benjamin after their families: of Bela, the family of the Belaites; of Ashbel, the family of the Ashbelites; of Ahiram, the family of the Ahiramites;
of Shephupham, the family of the Shuphamites; of Hupham, the family of the Huphamites.
And the sons of Bela were Ard and Naaman; [of Ard,] the family of the Ardites; of Naaman, the family of the Naamites.
These are the sons of Benjamin after their families; and they that were numbered of them were forty and five thousand and six hundred.
These are the sons of Dan after their families: of Shuham, the family of the Shuhamites. These are the families of Dan after their families.
All the families of the Shuhamites, according to those that were numbered of them, were threescore and four thousand and four hundred. .
The sons of Asher after their families: of Imnah, the family of the Imnites; of Ishvi, the family of the Ishvites; of Beriah, the family of the Beriites.
Of the sons of Beriah: of Heber, the family of the Heberites; of Malchiel, the family of the Malchielites.
And the name of the daughter of Asher was Serah.
These are the families of the sons of Asher according to those that were numbered of them, fifty and three thousand and four hundred.
The sons of Naphtali after their families: of Jahzeel, the family of the Jahzeelites; of Guni, the family of the Gunites;
of Jezer, the family of the Jezerites; of Shillem, the family of the Shillemites.
These are the families of Naphtali according to their families; and they that were numbered of them were forty and five thousand and four hundred.
These are they that were numbered of the children of Israel, six hundred thousand and a thousand and seven hundred and thirty.",Torah::Numbers::Pinchas Type::Sequence Aliyah::2
JPS1917|Numbers 26:52-27:5|seq3,Numbers 26:52-27:5,Pinchas,"And the LORD spoke unto Moses, saying:
’Unto these the land shall be divided for an inheritance according to the number of names.
To the more thou shalt give the more inheritance, and to the fewer thou shalt give the less inheritance; to each one according to those that were numbered of it shall its inheritance be given.
Notwithstanding the land shall be divided by lot; according to the names of the tribes of their fathers they shall inherit.
According to the lot shall their inheritance be divided between the more and the fewer.’
And these are they that were numbered of the Levites after their families: of Gershon, the family of the Gershonites; of Kohath, the family of the Kohathites; of Merari, the family of the Merarites.
These are the families of Levi: the family of the Libnites, the family of the Hebronites, the family of the Mahlites, the family of the Mushites, the family of the Korahites. And Kohath begot Amram.
And the name of Amram’s wife was Jochebed, the daughter of Levi, who was born to Levi in Egypt; and she bore unto Amram Aaron and Moses, and Miriam their sister.
And unto Aaron were born Nadab and Abihu, Eleazar and Ithamar.
And Nadab and Abihu died, when they offered strange fire before the LORD.
And they that were numbered of them were twenty and three thousand, every male from a month old and upward; for they were not numbered among the children of Israel, because there was no inheritance given them among the children of Israel.
These are they that were numbered by Moses and Eleazar the priest, who numbered the children of Israel in the plains of Moab by the Jordan at Jericho.
But among these there was not a man of them that were numbered by Moses and Aaron the priest, who numbered the children of Israel in the wilderness of Sinai.
For the LORD had said of them: ‘They shall surely die in the wilderness.’ And there was not left a man of them, save Caleb the son of Jephunneh, and Joshua the son of Nun.
Then drew near the daughters of Zelophehad, the son of Hepher, the son of Gilead, the son of Machir, the son of Manasseh, of the families of Manasseh the son of Joseph; and these are the names of his daughters: Mahlah, Noah, and Hoglah, and Milcah, and Tirzah.
And they stood before Moses, and before Eleazar the priest, and before the princes and all the congregation, at the door of the tent of meeting, saying:
’Our father died in the wilderness, and he was not among the company of them that gathered themselves together against the LORD in the company of Korah, but he died in his own sin; and he had no sons.
Why should the name of our father be done away from among his family, because he had no son? Give unto us a possession among the brethren of our father.’
And Moses brought their cause before the LORD.",Torah::Numbers::Pinchas Type::Sequence Aliyah::3
JPS1917|Numbers 27:6-27:23|seq4,Numbers 27:6-27:23,Pinchas,"And the LORD spoke unto Moses, saying:
’The daughters of Zelophehad speak right: thou shalt surely give them a possession of an inheritance among their father’s brethren; and thou shalt cause the inheritance of their father to pass unto them.
And thou shalt speak unto the children of Israel, saying: If a man die, and have no son, then ye shall cause his inheritance to pass unto his daughter.
And if he have no daughter, then ye shall give his inheritance unto his brethren.
And if he have no brethren, then ye shall give his inheritance unto his father’s brethren.
And if his father have no brethren, then ye shall give his inheritance unto his kinsman that is next to him of his family, and he shall possess it. And it shall be unto the children of Israel a statute of judgment, as the LORD commanded Moses.’
And the LORD said unto Moses: ‘Get thee up into this mountain of Abarim, and behold the land which I have given unto the children of Israel.
And when thou hast seen it, thou also shalt be gathered unto thy people, as Aaron thy brother was gathered;
because ye rebelled against My commandment in the wilderness of Zin, in the strife of the congregation, to sanctify Me at the waters before their eyes.’—These are the waters of Meribath-kadesh in the wilderness of Zin.—
And Moses spoke unto the LORD, saying:
’Let the LORD, the God of the spirits of all flesh, set a man over the congregation,
who may go out before them, and who may come in before them, and who may lead them out, and who may bring them in; that the congregation of the LORD be not as sheep which have no shepherd.’
And the LORD said unto Moses: ‘Take thee Joshua the son of Nun, a man in whom is spirit, and lay thy hand upon him;
and set him before Eleazar the priest, and before all the congregation; and give him a charge in their sight.
And thou shalt put of thy honour upon him, that all the congregation of the children of Israel may hearken.
And he shall stand before Eleazar the priest, who shall inquire for him by the judgment of the Urim before the LORD; at his word shall they go out, and at his word they shall come in, both he, and all the children of Israel with him, even all the congregation.’
And Moses did as the LORD commanded him; and he took Joshua, and set him before Eleazar the priest, and before all the congregation.
And he laid his hands upon him, and gave him a charge, as the LORD spoke by the hand of Moses.",Torah::Numbers::Pinchas Type::Sequence Aliyah::4
