JPS1917|Leviticus 25:54|c2,Leviticus 25:54,Behar,"And if he be not redeemed by any of these means, then he shall go out in the year of {{c1::jubilee}}, he, and his children with him.",Torah::Leviticus::Behar Type::AutoCloze
JPS1917|Leviticus 25:55|c1,Leviticus 25:55,Behar,For unto {{c1::Me}} the children of Israel are servants; they are My servants whom I brought forth out of the land of Egypt: I am the LORD your God.,Torah::Leviticus::Behar Type::AutoCloze
JPS1917|Leviticus 25:55|c2,Leviticus 25:55,Behar,For unto Me the children of {{c1::Israel}} are servants; they are My servants whom I brought forth out of the land of Egypt: I am the LORD your God.,Torah::Leviticus::Behar Type::AutoCloze
JPS1917|Leviticus 26:1|c1,Leviticus 26:1,Behar,"Ye shall make you no idols, neither shall ye rear you up a graven image, or a pillar, neither shall ye place any figured stone in your land, to bow down unto it; for {{c1::I}} am the LORD your God.",Torah::Leviticus::Behar Type::AutoCloze
JPS1917|Leviticus 26:1|c2,Leviticus 26:1,Behar,"Ye shall make you no idols, {{c1::neither}} shall ye rear you up a graven image, or a pillar, neither shall ye place any figured stone in your land, to bow down unto it; for I am the LORD your God.",Torah::Leviticus::Behar Type::AutoCloze
JPS1917|Leviticus 26:2|c1,Leviticus 26:2,Behar,"Ye shall keep {{c1::My}} sabbaths, and reverence My sanctuary: I am the LORD.",Torah::Leviticus::Behar Type::AutoCloze
JPS1917|Leviticus 26:2|c2,Leviticus 26:2,Behar,"Ye shall keep My sabbaths, and reverence My sanctuary: {{c1::I}} am the LORD.",Torah::Leviticus::Behar Type::AutoCloze
