JPS1917|Leviticus 20:18|c1,Leviticus 20:18,Kedoshim,"And if a man shall lie with a woman {{c1::having}} her sickness, and shall uncover her nakedness—he hath made naked her fountain, and she hath uncovered the fountain of her blood—both of them shall be cut off from among their people.",Torah::Leviticus::Kedoshim Type::AutoCloze
JPS1917|Leviticus 20:18|c2,Leviticus 20:18,Kedoshim,"And if a man shall lie with a woman having her {{c1::sickness}}, and shall uncover her nakedness—he hath made naked her fountain, and she hath uncovered the fountain of her blood—both of them shall be cut off from among their people.",Torah::Leviticus::Kedoshim Type::AutoCloze
JPS1917|Leviticus 20:19|c1,Leviticus 20:19,Kedoshim,"And thou shalt not {{c1::uncover}} the nakedness of thy mother’s sister, nor of thy father’s sister; for he hath made naked his near kin; they shall bear their iniquity.",Torah::Leviticus::Kedoshim Type::AutoCloze
JPS1917|Leviticus 20:19|c2,Leviticus 20:19,Kedoshim,"And thou shalt not uncover the {{c1::nakedness}} of thy mother’s sister, nor of thy father’s sister; for he hath made naked his near kin; they shall bear their iniquity.",Torah::Leviticus::Kedoshim Type::AutoCloze
JPS1917|Leviticus 20:20|c1,Leviticus 20:20,Kedoshim,And if a man shall lie with his {{c1::uncle’s}} wife—he hath uncovered his uncle’s nakedness—they shall bear their sin; they shall die childless.,Torah::Leviticus::Kedoshim Type::AutoCloze
JPS1917|Leviticus 20:20|c2,Leviticus 20:20,Kedoshim,And if a man shall lie with his uncle’s wife—he hath {{c1::uncovered}} his uncle’s nakedness—they shall bear their sin; they shall die childless.,Torah::Leviticus::Kedoshim Type::AutoCloze
JPS1917|Leviticus 20:21|c1,Leviticus 20:21,Kedoshim,"And if a man shall take his {{c1::brother’s}} wife, it is impurity: he hath uncovered his brother’s nakedness; they shall be childless.",Torah::Leviticus::Kedoshim Type::AutoCloze
JPS1917|Leviticus 20:21|c2,Leviticus 20:21,Kedoshim,"And if a man shall take his brother’s wife, it is {{c1::impurity}}: he hath uncovered his brother’s nakedness; they shall be childless.",Torah::Leviticus::Kedoshim Type::AutoCloze
JPS1917|Leviticus 20:22|c1,Leviticus 20:22,Kedoshim,"Ye shall therefore keep all {{c1::My}} statutes, and all Mine ordinances, and do them, that the land, whither I bring you to dwell therein, vomit you not out.",Torah::Leviticus::Kedoshim Type::AutoCloze
JPS1917|Leviticus 20:22|c2,Leviticus 20:22,Kedoshim,"Ye shall therefore keep all My statutes, and all {{c1::Mine}} ordinances, and do them, that the land, whither I bring you to dwell therein, vomit you not out.",Torah::Leviticus::Kedoshim Type::AutoCloze
JPS1917|Leviticus 20:23|c1,Leviticus 20:23,Kedoshim,"And ye shall not walk in the customs of the nation, which {{c1::I}} am casting out before you; for they did all these things, and therefore I abhorred them.",Torah::Leviticus::Kedoshim Type::AutoCloze
JPS1917|Leviticus 20:23|c2,Leviticus 20:23,Kedoshim,"And ye shall not walk in the {{c1::customs}} of the nation, which I am casting out before you; for they did all these things, and therefore I abhorred them.",Torah::Leviticus::Kedoshim Type::AutoCloze
JPS1917|Leviticus 20:24|c1,Leviticus 20:24,Kedoshim,"But {{c1::I}} have said unto you: ‘Ye shall inherit their land, and I will give it unto you to possess it, a land flowing with milk and honey.’ I am the LORD your God, who have set you apart from the peoples.",Torah::Leviticus::Kedoshim Type::AutoCloze
JPS1917|Leviticus 20:24|c2,Leviticus 20:24,Kedoshim,"But I have said unto you: ‘{{c1::Ye}} shall inherit their land, and I will give it unto you to possess it, a land flowing with milk and honey.’ I am the LORD your God, who have set you apart from the peoples.",Torah::Leviticus::Kedoshim Type::AutoCloze
JPS1917|Leviticus 20:25|c1,Leviticus 20:25,Kedoshim,"Ye shall therefore separate between the clean beast and the unclean, and between the unclean fowl and the clean; and ye shall not make your souls detestable by beast, or by fowl, or by any thing wherewith the ground teemeth, which {{c1::I}} have set apart for you to hold unclean.",Torah::Leviticus::Kedoshim Type::AutoCloze
JPS1917|Leviticus 20:25|c2,Leviticus 20:25,Kedoshim,"Ye shall {{c1::therefore}} separate between the clean beast and the unclean, and between the unclean fowl and the clean; and ye shall not make your souls detestable by beast, or by fowl, or by any thing wherewith the ground teemeth, which I have set apart for you to hold unclean.",Torah::Leviticus::Kedoshim Type::AutoCloze
JPS1917|Leviticus 20:26|c1,Leviticus 20:26,Kedoshim,"And ye shall be holy unto {{c1::Me}}; for I the LORD am holy, and have set you apart from the peoples, that ye should be Mine.",Torah::Leviticus::Kedoshim Type::AutoCloze
JPS1917|Leviticus 20:26|c2,Leviticus 20:26,Kedoshim,"And ye shall be holy unto Me; for {{c1::I}} the LORD am holy, and have set you apart from the peoples, that ye should be Mine.",Torah::Leviticus::Kedoshim Type::AutoCloze
JPS1917|Leviticus 20:27|c1,Leviticus 20:27,Kedoshim,"A man also or a woman that {{c1::divineth}} by a ghost or a familiar spirit, shall surely be put to death; they shall stone them with stones; their blood shall be upon them.",Torah::Leviticus::Kedoshim Type::AutoCloze
JPS1917|Leviticus 20:27|c2,Leviticus 20:27,Kedoshim,"A man also or a woman that divineth by a ghost or a {{c1::familiar}} spirit, shall surely be put to death; they shall stone them with stones; their blood shall be upon them.",Torah::Leviticus::Kedoshim Type::AutoCloze
