JPS1917|Leviticus 19:1|c1,Leviticus 19:1,Kedoshim,"And the LORD spoke unto {{c1::Moses}}, saying:",Torah::Leviticus::Kedoshim Type::AutoCloze
JPS1917|Leviticus 19:1|c2,Leviticus 19:1,Kedoshim,"And the LORD spoke unto Moses, {{c1::saying}}:",Torah::Leviticus::Kedoshim Type::AutoCloze
JPS1917|Leviticus 19:2|c1,Leviticus 19:2,Kedoshim,"Speak unto all the congregation of the children of {{c1::Israel}}, and say unto them: Ye shall be holy; for I the LORD your God am holy.",Torah::Leviticus::Kedoshim Type::AutoCloze
JPS1917|Leviticus 19:2|c2,Leviticus 19:2,Kedoshim,"Speak unto all the congregation of the children of Israel, and say unto them: {{c1::Ye}} shall be holy; for I the LORD your God am holy.",Torah::Leviticus::Kedoshim Type::AutoCloze
JPS1917|Leviticus 19:3|c1,Leviticus 19:3,Kedoshim,"Ye shall fear every man his mother, and his father, and ye shall keep {{c1::My}} sabbaths: I am the LORD your God.",Torah::Leviticus::Kedoshim Type::AutoCloze
JPS1917|Leviticus 19:3|c2,Leviticus 19:3,Kedoshim,"Ye shall fear every man his mother, and his father, and ye shall keep My sabbaths: {{c1::I}} am the LORD your God.",Torah::Leviticus::Kedoshim Type::AutoCloze
JPS1917|Leviticus 19:4|c1,Leviticus 19:4,Kedoshim,"Turn ye not unto the idols, nor make to yourselves molten gods: {{c1::I}} am the LORD your God.",Torah::Leviticus::Kedoshim Type::AutoCloze
JPS1917|Leviticus 19:4|c2,Leviticus 19:4,Kedoshim,"Turn ye not unto the idols, nor make to {{c1::yourselves}} molten gods: I am the LORD your God.",Torah::Leviticus::Kedoshim Type::AutoCloze
JPS1917|Leviticus 19:5|c1,Leviticus 19:5,Kedoshim,"And when ye offer a {{c1::sacrifice}} of peace-offerings unto the LORD, ye shall offer it that ye may be accepted.",Torah::Leviticus::Kedoshim Type::AutoCloze
JPS1917|Leviticus 19:5|c2,Leviticus 19:5,Kedoshim,"And when ye offer a sacrifice of peace-{{c1::offerings}} unto the LORD, ye shall offer it that ye may be accepted.",Torah::Leviticus::Kedoshim Type::AutoCloze
JPS1917|Leviticus 19:6|c1,Leviticus 19:6,Kedoshim,"It shall be eaten the same day ye offer it, and on the {{c1::morrow}}; and if aught remain until the third day, it shall be burnt with fire.",Torah::Leviticus::Kedoshim Type::AutoCloze
JPS1917|Leviticus 19:6|c2,Leviticus 19:6,Kedoshim,"It shall be eaten the same day ye offer it, and on the morrow; and if aught {{c1::remain}} until the third day, it shall be burnt with fire.",Torah::Leviticus::Kedoshim Type::AutoCloze
JPS1917|Leviticus 19:7|c1,Leviticus 19:7,Kedoshim,"And if it be eaten at all on the third day, it is a vile thing; it shall not be {{c1::accepted}}.",Torah::Leviticus::Kedoshim Type::AutoCloze
JPS1917|Leviticus 19:8|c1,Leviticus 19:8,Kedoshim,"But every one that {{c1::eateth}} it shall bear his iniquity, because he hath profaned the holy thing of the LORD; and that soul shall be cut off from his people.",Torah::Leviticus::Kedoshim Type::AutoCloze
JPS1917|Leviticus 19:8|c2,Leviticus 19:8,Kedoshim,"But every one that eateth it shall bear his {{c1::iniquity}}, because he hath profaned the holy thing of the LORD; and that soul shall be cut off from his people.",Torah::Leviticus::Kedoshim Type::AutoCloze
JPS1917|Leviticus 19:9|c1,Leviticus 19:9,Kedoshim,"And when ye reap the {{c1::harvest}} of your land, thou shalt not wholly reap the corner of thy field, neither shalt thou gather the gleaning of thy harvest.",Torah::Leviticus::Kedoshim Type::AutoCloze
JPS1917|Leviticus 19:9|c2,Leviticus 19:9,Kedoshim,"And when ye reap the harvest of your land, thou shalt not {{c1::wholly}} reap the corner of thy field, neither shalt thou gather the gleaning of thy harvest.",Torah::Leviticus::Kedoshim Type::AutoCloze
JPS1917|Leviticus 19:10|c1,Leviticus 19:10,Kedoshim,"And thou shalt not glean thy vineyard, neither shalt thou gather the fallen fruit of thy vineyard; thou shalt leave them for the poor and for the stranger: {{c1::I}} am the LORD your God.",Torah::Leviticus::Kedoshim Type::AutoCloze
JPS1917|Leviticus 19:10|c2,Leviticus 19:10,Kedoshim,"And thou shalt not glean thy {{c1::vineyard}}, neither shalt thou gather the fallen fruit of thy vineyard; thou shalt leave them for the poor and for the stranger: I am the LORD your God.",Torah::Leviticus::Kedoshim Type::AutoCloze
JPS1917|Leviticus 19:11|c1,Leviticus 19:11,Kedoshim,"Ye shall not steal; {{c1::neither}} shall ye deal falsely, nor lie one to another.",Torah::Leviticus::Kedoshim Type::AutoCloze
JPS1917|Leviticus 19:11|c2,Leviticus 19:11,Kedoshim,"Ye shall not steal; neither shall ye deal {{c1::falsely}}, nor lie one to another.",Torah::Leviticus::Kedoshim Type::AutoCloze
JPS1917|Leviticus 19:12|c1,Leviticus 19:12,Kedoshim,"And ye shall not swear by {{c1::My}} name falsely, so that thou profane the name of thy God: I am the LORD.",Torah::Leviticus::Kedoshim Type::AutoCloze
JPS1917|Leviticus 19:12|c2,Leviticus 19:12,Kedoshim,"And ye shall not swear by My name falsely, so that thou profane the name of thy God: {{c1::I}} am the LORD.",Torah::Leviticus::Kedoshim Type::AutoCloze
JPS1917|Leviticus 19:13|c1,Leviticus 19:13,Kedoshim,"Thou shalt not {{c1::oppress}} thy neighbour, nor rob him; the wages of a hired servant shall not abide with thee all night until the morning.",Torah::Leviticus::Kedoshim Type::AutoCloze
JPS1917|Leviticus 19:13|c2,Leviticus 19:13,Kedoshim,"Thou shalt not oppress thy {{c1::neighbour}}, nor rob him; the wages of a hired servant shall not abide with thee all night until the morning.",Torah::Leviticus::Kedoshim Type::AutoCloze
JPS1917|Leviticus 19:14|c1,Leviticus 19:14,Kedoshim,"Thou shalt not curse the deaf, nor put a stumbling-block before the blind, but thou shalt fear thy God: {{c1::I}} am the LORD.",Torah::Leviticus::Kedoshim Type::AutoCloze
JPS1917|Leviticus 19:14|c2,Leviticus 19:14,Kedoshim,"Thou shalt not curse the deaf, nor put a {{c1::stumbling}}-block before the blind, but thou shalt fear thy God: I am the LORD.",Torah::Leviticus::Kedoshim Type::AutoCloze
JPS1917|Leviticus 19:15|c1,Leviticus 19:15,Kedoshim,"Ye shall do no {{c1::unrighteousness}} in judgment; thou shalt not respect the person of the poor, nor favour the person of the mighty; but in righteousness shalt thou judge thy neighbour.",Torah::Leviticus::Kedoshim Type::AutoCloze
JPS1917|Leviticus 19:15|c2,Leviticus 19:15,Kedoshim,"Ye shall do no unrighteousness in {{c1::judgment}}; thou shalt not respect the person of the poor, nor favour the person of the mighty; but in righteousness shalt thou judge thy neighbour.",Torah::Leviticus::Kedoshim Type::AutoCloze
JPS1917|Leviticus 19:16|c1,Leviticus 19:16,Kedoshim,Thou shalt not go up and down as a talebearer among thy people; neither shalt thou stand idly by the blood of thy neighbour: {{c1::I}} am the LORD.,Torah::Leviticus::Kedoshim Type::AutoCloze
JPS1917|Leviticus 19:16|c2,Leviticus 19:16,Kedoshim,Thou shalt not go up and down as a {{c1::talebearer}} among thy people; neither shalt thou stand idly by the blood of thy neighbour: I am the LORD.,Torah::Leviticus::Kedoshim Type::AutoCloze
JPS1917|Leviticus 19:17|c1,Leviticus 19:17,Kedoshim,"Thou shalt not hate thy {{c1::brother}} in thy heart; thou shalt surely rebuke thy neighbour, and not bear sin because of him.",Torah::Leviticus::Kedoshim Type::AutoCloze
JPS1917|Leviticus 19:17|c2,Leviticus 19:17,Kedoshim,"Thou shalt not hate thy brother in thy heart; thou shalt {{c1::surely}} rebuke thy neighbour, and not bear sin because of him.",Torah::Leviticus::Kedoshim Type::AutoCloze
JPS1917|Leviticus 19:18|c1,Leviticus 19:18,Kedoshim,"Thou shalt not take vengeance, nor bear any grudge against the children of thy people, but thou shalt love thy neighbour as thyself: {{c1::I}} am the LORD.",Torah::Leviticus::Kedoshim Type::AutoCloze
JPS1917|Leviticus 19:18|c2,Leviticus 19:18,Kedoshim,"Thou shalt not take {{c1::vengeance}}, nor bear any grudge against the children of thy people, but thou shalt love thy neighbour as thyself: I am the LORD.",Torah::Leviticus::Kedoshim Type::AutoCloze
JPS1917|Leviticus 19:19|c1,Leviticus 19:19,Kedoshim,Ye shall keep {{c1::My}} statutes. Thou shalt not let thy cattle gender with a diverse kind; thou shalt not sow thy field with two kinds of seed; neither shall there come upon thee a garment of two kinds of stuff mingled together.,Torah::Leviticus::Kedoshim Type::AutoCloze
JPS1917|Leviticus 19:19|c2,Leviticus 19:19,Kedoshim,Ye shall keep My statutes. {{c1::Thou}} shalt not let thy cattle gender with a diverse kind; thou shalt not sow thy field with two kinds of seed; neither shall there come upon thee a garment of two kinds of stuff mingled together.,Torah::Leviticus::Kedoshim Type::AutoCloze
JPS1917|Leviticus 19:20|c1,Leviticus 19:20,Kedoshim,"And {{c1::whosoever}} lieth carnally with a woman, that is a bondmaid, designated for a man, and not at all redeemed, nor was freedom given her; there shall be inquisition; they shall not be put to death, because she was not free.",Torah::Leviticus::Kedoshim Type::AutoCloze
JPS1917|Leviticus 19:20|c2,Leviticus 19:20,Kedoshim,"And whosoever lieth {{c1::carnally}} with a woman, that is a bondmaid, designated for a man, and not at all redeemed, nor was freedom given her; there shall be inquisition; they shall not be put to death, because she was not free.",Torah::Leviticus::Kedoshim Type::AutoCloze
JPS1917|Leviticus 19:21|c1,Leviticus 19:21,Kedoshim,"And he shall bring his {{c1::forfeit}} unto the LORD, unto the door of the tent of meeting, even a ram for a guilt-offering.",Torah::Leviticus::Kedoshim Type::AutoCloze
JPS1917|Leviticus 19:21|c2,Leviticus 19:21,Kedoshim,"And he shall bring his forfeit unto the LORD, unto the door of the tent of {{c1::meeting}}, even a ram for a guilt-offering.",Torah::Leviticus::Kedoshim Type::AutoCloze
JPS1917|Leviticus 19:22|c1,Leviticus 19:22,Kedoshim,And the {{c1::priest}} shall make atonement for him with the ram of the guilt-offering before the LORD for his sin which he hath sinned; and he shall be forgiven for his sin which he hath sinned.,Torah::Leviticus::Kedoshim Type::AutoCloze
JPS1917|Leviticus 19:22|c2,Leviticus 19:22,Kedoshim,And the priest shall make {{c1::atonement}} for him with the ram of the guilt-offering before the LORD for his sin which he hath sinned; and he shall be forgiven for his sin which he hath sinned.,Torah::Leviticus::Kedoshim Type::AutoCloze
JPS1917|Leviticus 19:23|c1,Leviticus 19:23,Kedoshim,"And when ye shall come into the land, and shall have {{c1::planted}} all manner of trees for food, then ye shall count the fruit thereof as forbidden; three years shall it be as forbidden unto you; it shall not be eaten.",Torah::Leviticus::Kedoshim Type::AutoCloze
JPS1917|Leviticus 19:23|c2,Leviticus 19:23,Kedoshim,"And when ye shall come into the land, and shall have planted all {{c1::manner}} of trees for food, then ye shall count the fruit thereof as forbidden; three years shall it be as forbidden unto you; it shall not be eaten.",Torah::Leviticus::Kedoshim Type::AutoCloze
JPS1917|Leviticus 19:24|c1,Leviticus 19:24,Kedoshim,"And in the {{c1::fourth}} year all the fruit thereof shall be holy, for giving praise unto the LORD.",Torah::Leviticus::Kedoshim Type::AutoCloze
JPS1917|Leviticus 19:24|c2,Leviticus 19:24,Kedoshim,"And in the fourth year all the fruit {{c1::thereof}} shall be holy, for giving praise unto the LORD.",Torah::Leviticus::Kedoshim Type::AutoCloze
JPS1917|Leviticus 19:25|c1,Leviticus 19:25,Kedoshim,"But in the fifth year may ye eat of the fruit thereof, that it may yield unto you more richly the increase thereof: {{c1::I}} am the LORD your God.",Torah::Leviticus::Kedoshim Type::AutoCloze
JPS1917|Leviticus 19:25|c2,Leviticus 19:25,Kedoshim,"But in the fifth year may ye eat of the fruit {{c1::thereof}}, that it may yield unto you more richly the increase thereof: I am the LORD your God.",Torah::Leviticus::Kedoshim Type::AutoCloze
JPS1917|Leviticus 19:26|c1,Leviticus 19:26,Kedoshim,Ye shall not eat with the blood; {{c1::neither}} shall ye practise divination nor soothsaying.,Torah::Leviticus::Kedoshim Type::AutoCloze
JPS1917|Leviticus 19:26|c2,Leviticus 19:26,Kedoshim,Ye shall not eat with the blood; neither shall ye {{c1::practise}} divination nor soothsaying.,Torah::Leviticus::Kedoshim Type::AutoCloze
JPS1917|Leviticus 19:27|c1,Leviticus 19:27,Kedoshim,"Ye shall not round the {{c1::corners}} of your heads, neither shalt thou mar the corners of thy beard.",Torah::Leviticus::Kedoshim Type::AutoCloze
JPS1917|Leviticus 19:27|c2,Leviticus 19:27,Kedoshim,"Ye shall not round the corners of your heads, {{c1::neither}} shalt thou mar the corners of thy beard.",Torah::Leviticus::Kedoshim Type::AutoCloze
JPS1917|Leviticus 19:28|c1,Leviticus 19:28,Kedoshim,"Ye shall not make any cuttings in your flesh for the dead, nor imprint any marks upon you: {{c1::I}} am the LORD.",Torah::Leviticus::Kedoshim Type::AutoCloze
JPS1917|Leviticus 19:28|c2,Leviticus 19:28,Kedoshim,"Ye shall not make any {{c1::cuttings}} in your flesh for the dead, nor imprint any marks upon you: I am the LORD.",Torah::Leviticus::Kedoshim Type::AutoCloze
JPS1917|Leviticus 19:29|c1,Leviticus 19:29,Kedoshim,"{{c1::Profane}} not thy daughter, to make her a harlot, lest the land fall into harlotry, and the land become full of lewdness.",Torah::Leviticus::Kedoshim Type::AutoCloze
JPS1917|Leviticus 19:29|c2,Leviticus 19:29,Kedoshim,"Profane not thy {{c1::daughter}}, to make her a harlot, lest the land fall into harlotry, and the land become full of lewdness.",Torah::Leviticus::Kedoshim Type::AutoCloze
JPS1917|Leviticus 19:30|c1,Leviticus 19:30,Kedoshim,"Ye shall keep {{c1::My}} sabbaths, and reverence My sanctuary: I am the LORD.",Torah::Leviticus::Kedoshim Type::AutoCloze
JPS1917|Leviticus 19:30|c2,Leviticus 19:30,Kedoshim,"Ye shall keep My sabbaths, and reverence My sanctuary: {{c1::I}} am the LORD.",Torah::Leviticus::Kedoshim Type::AutoCloze
JPS1917|Leviticus 19:31|c1,Leviticus 19:31,Kedoshim,"Turn ye not unto the ghosts, nor unto familiar spirits; seek them not out, to be defiled by them: {{c1::I}} am the LORD your God.",Torah::Leviticus::Kedoshim Type::AutoCloze
JPS1917|Leviticus 19:31|c2,Leviticus 19:31,Kedoshim,"Turn ye not unto the {{c1::ghosts}}, nor unto familiar spirits; seek them not out, to be defiled by them: I am the LORD your God.",Torah::Leviticus::Kedoshim Type::AutoCloze
JPS1917|Leviticus 19:32|c1,Leviticus 19:32,Kedoshim,"Thou shalt rise up before the hoary head, and honour the face of the old man, and thou shalt fear thy God: {{c1::I}} am the LORD.",Torah::Leviticus::Kedoshim Type::AutoCloze
JPS1917|Leviticus 19:32|c2,Leviticus 19:32,Kedoshim,"Thou shalt rise up {{c1::before}} the hoary head, and honour the face of the old man, and thou shalt fear thy God: I am the LORD.",Torah::Leviticus::Kedoshim Type::AutoCloze
JPS1917|Leviticus 19:33|c1,Leviticus 19:33,Kedoshim,"And if a {{c1::stranger}} sojourn with thee in your land, ye shall not do him wrong.",Torah::Leviticus::Kedoshim Type::AutoCloze
JPS1917|Leviticus 19:33|c2,Leviticus 19:33,Kedoshim,"And if a stranger {{c1::sojourn}} with thee in your land, ye shall not do him wrong.",Torah::Leviticus::Kedoshim Type::AutoCloze
JPS1917|Leviticus 19:34|c1,Leviticus 19:34,Kedoshim,"The stranger that sojourneth with you shall be unto you as the home-born among you, and thou shalt love him as thyself; for ye were strangers in the land of {{c1::Egypt}}: I am the LORD your God.",Torah::Leviticus::Kedoshim Type::AutoCloze
JPS1917|Leviticus 19:34|c2,Leviticus 19:34,Kedoshim,"The stranger that sojourneth with you shall be unto you as the home-born among you, and thou shalt love him as thyself; for ye were strangers in the land of Egypt: {{c1::I}} am the LORD your God.",Torah::Leviticus::Kedoshim Type::AutoCloze
JPS1917|Leviticus 19:35|c1,Leviticus 19:35,Kedoshim,"Ye shall do no {{c1::unrighteousness}} in judgment, in meteyard, in weight, or in measure.",Torah::Leviticus::Kedoshim Type::AutoCloze
JPS1917|Leviticus 19:35|c2,Leviticus 19:35,Kedoshim,"Ye shall do no unrighteousness in {{c1::judgment}}, in meteyard, in weight, or in measure.",Torah::Leviticus::Kedoshim Type::AutoCloze
JPS1917|Leviticus 19:36|c1,Leviticus 19:36,Kedoshim,"Just balances, just weights, a just ephah, and a just hin, shall ye have: {{c1::I}} am the LORD your God, who brought you out of the land of Egypt.",Torah::Leviticus::Kedoshim Type::AutoCloze
JPS1917|Leviticus 19:36|c2,Leviticus 19:36,Kedoshim,"Just balances, just weights, a just ephah, and a just hin, shall ye have: I am the LORD your God, who brought you out of the land of {{c1::Egypt}}.",Torah::Leviticus::Kedoshim Type::AutoCloze
JPS1917|Leviticus 19:37|c1,Leviticus 19:37,Kedoshim,"And ye shall observe all {{c1::My}} statutes, and all Mine ordinances, and do them: I am the LORD.",Torah::Leviticus::Kedoshim Type::AutoCloze
JPS1917|Leviticus 19:37|c2,Leviticus 19:37,Kedoshim,"And ye shall observe all My statutes, and all {{c1::Mine}} ordinances, and do them: I am the LORD.",Torah::Leviticus::Kedoshim Type::AutoCloze
JPS1917|Leviticus 20:1|c1,Leviticus 20:1,Kedoshim,"And the LORD spoke unto {{c1::Moses}}, saying:",Torah::Leviticus::Kedoshim Type::AutoCloze
JPS1917|Leviticus 20:1|c2,Leviticus 20:1,Kedoshim,"And the LORD spoke unto Moses, {{c1::saying}}:",Torah::Leviticus::Kedoshim Type::AutoCloze
JPS1917|Leviticus 20:2|c1,Leviticus 20:2,Kedoshim,"Moreover, thou shalt say to the children of {{c1::Israel}}: Whosoever he be of the children of Israel, or of the strangers that sojourn in Israel, that giveth of his seed unto Molech; he shall surely be put to death; the people of the land shall stone him with stones.",Torah::Leviticus::Kedoshim Type::AutoCloze
JPS1917|Leviticus 20:2|c2,Leviticus 20:2,Kedoshim,"Moreover, thou shalt say to the children of Israel: {{c1::Whosoever}} he be of the children of Israel, or of the strangers that sojourn in Israel, that giveth of his seed unto Molech; he shall surely be put to death; the people of the land shall stone him with stones.",Torah::Leviticus::Kedoshim Type::AutoCloze
JPS1917|Leviticus 20:3|c1,Leviticus 20:3,Kedoshim,"I also will set {{c1::My}} face against that man, and will cut him off from among his people, because he hath given of his seed unto Molech, to defile My sanctuary, and to profane My holy name.",Torah::Leviticus::Kedoshim Type::AutoCloze
JPS1917|Leviticus 20:3|c2,Leviticus 20:3,Kedoshim,"I also will set My face against that man, and will cut him off from among his people, because he hath given of his seed unto {{c1::Molech}}, to defile My sanctuary, and to profane My holy name.",Torah::Leviticus::Kedoshim Type::AutoCloze
JPS1917|Leviticus 20:4|c1,Leviticus 20:4,Kedoshim,"And if the people of the land do at all hide their eyes from that man, when he giveth of his seed unto {{c1::Molech}}, and put him not to death;",Torah::Leviticus::Kedoshim Type::AutoCloze
JPS1917|Leviticus 20:4|c2,Leviticus 20:4,Kedoshim,"And if the {{c1::people}} of the land do at all hide their eyes from that man, when he giveth of his seed unto Molech, and put him not to death;",Torah::Leviticus::Kedoshim Type::AutoCloze
JPS1917|Leviticus 20:5|c1,Leviticus 20:5,Kedoshim,"then {{c1::I}} will set My face against that man, and against his family, and will cut him off, and all that go astray after him, to go astray after Molech, from among their people.",Torah::Leviticus::Kedoshim Type::AutoCloze
JPS1917|Leviticus 20:5|c2,Leviticus 20:5,Kedoshim,"then I will set {{c1::My}} face against that man, and against his family, and will cut him off, and all that go astray after him, to go astray after Molech, from among their people.",Torah::Leviticus::Kedoshim Type::AutoCloze
JPS1917|Leviticus 20:6|c1,Leviticus 20:6,Kedoshim,"And the soul that turneth unto the ghosts, and unto the familiar spirits, to go astray after them, {{c1::I}} will even set My face against that soul, and will cut him off from among his people.",Torah::Leviticus::Kedoshim Type::AutoCloze
JPS1917|Leviticus 20:6|c2,Leviticus 20:6,Kedoshim,"And the soul that turneth unto the ghosts, and unto the familiar spirits, to go astray after them, I will even set {{c1::My}} face against that soul, and will cut him off from among his people.",Torah::Leviticus::Kedoshim Type::AutoCloze
JPS1917|Leviticus 20:7|c1,Leviticus 20:7,Kedoshim,"Sanctify yourselves therefore, and be ye holy; for {{c1::I}} am the LORD your God.",Torah::Leviticus::Kedoshim Type::AutoCloze
JPS1917|Leviticus 20:7|c2,Leviticus 20:7,Kedoshim,"{{c1::Sanctify}} yourselves therefore, and be ye holy; for I am the LORD your God.",Torah::Leviticus::Kedoshim Type::AutoCloze
JPS1917|Leviticus 20:8|c1,Leviticus 20:8,Kedoshim,"And keep ye {{c1::My}} statutes, and do them: I am the LORD who sanctify you.",Torah::Leviticus::Kedoshim Type::AutoCloze
JPS1917|Leviticus 20:8|c2,Leviticus 20:8,Kedoshim,"And keep ye My statutes, and do them: {{c1::I}} am the LORD who sanctify you.",Torah::Leviticus::Kedoshim Type::AutoCloze
JPS1917|Leviticus 20:9|c1,Leviticus 20:9,Kedoshim,For {{c1::whatsoever}} man there be that curseth his father or his mother shall surely be put to death; he hath cursed his father or his mother; his blood shall be upon him.,Torah::Leviticus::Kedoshim Type::AutoCloze
JPS1917|Leviticus 20:9|c2,Leviticus 20:9,Kedoshim,For whatsoever man there be that {{c1::curseth}} his father or his mother shall surely be put to death; he hath cursed his father or his mother; his blood shall be upon him.,Torah::Leviticus::Kedoshim Type::AutoCloze
JPS1917|Leviticus 20:10|c1,Leviticus 20:10,Kedoshim,"And the man that {{c1::committeth}} adultery with another man’s wife, even he that committeth adultery with his neighbour’s wife, both the adulterer and the adulteress shall surely be put to death.",Torah::Leviticus::Kedoshim Type::AutoCloze
JPS1917|Leviticus 20:10|c2,Leviticus 20:10,Kedoshim,"And the man that committeth {{c1::adultery}} with another man’s wife, even he that committeth adultery with his neighbour’s wife, both the adulterer and the adulteress shall surely be put to death.",Torah::Leviticus::Kedoshim Type::AutoCloze
JPS1917|Leviticus 20:11|c1,Leviticus 20:11,Kedoshim,And the man that lieth with his {{c1::father’s}} wife—he hath uncovered his father’s nakedness—both of them shall surely be put to death; their blood shall be upon them.,Torah::Leviticus::Kedoshim Type::AutoCloze
JPS1917|Leviticus 20:11|c2,Leviticus 20:11,Kedoshim,And the man that lieth with his father’s wife—he hath {{c1::uncovered}} his father’s nakedness—both of them shall surely be put to death; their blood shall be upon them.,Torah::Leviticus::Kedoshim Type::AutoCloze
JPS1917|Leviticus 20:12|c1,Leviticus 20:12,Kedoshim,"And if a man lie with his {{c1::daughter}}-in-law, both of them shall surely be put to death; they have wrought corruption; their blood shall be upon them.",Torah::Leviticus::Kedoshim Type::AutoCloze
JPS1917|Leviticus 20:12|c2,Leviticus 20:12,Kedoshim,"And if a man lie with his daughter-in-law, both of them shall {{c1::surely}} be put to death; they have wrought corruption; their blood shall be upon them.",Torah::Leviticus::Kedoshim Type::AutoCloze
JPS1917|Leviticus 20:13|c1,Leviticus 20:13,Kedoshim,"And if a man lie with {{c1::mankind}}, as with womankind, both of them have committed abomination: they shall surely be put to death; their blood shall be upon them.",Torah::Leviticus::Kedoshim Type::AutoCloze
JPS1917|Leviticus 20:13|c2,Leviticus 20:13,Kedoshim,"And if a man lie with mankind, as with {{c1::womankind}}, both of them have committed abomination: they shall surely be put to death; their blood shall be upon them.",Torah::Leviticus::Kedoshim Type::AutoCloze
JPS1917|Leviticus 20:14|c1,Leviticus 20:14,Kedoshim,"And if a man take with his wife also her {{c1::mother}}, it is wickedness: they shall be burnt with fire, both he and they; that there be no wickedness among you.",Torah::Leviticus::Kedoshim Type::AutoCloze
JPS1917|Leviticus 20:14|c2,Leviticus 20:14,Kedoshim,"And if a man take with his wife also her mother, it is {{c1::wickedness}}: they shall be burnt with fire, both he and they; that there be no wickedness among you.",Torah::Leviticus::Kedoshim Type::AutoCloze
JPS1917|Leviticus 20:15|c1,Leviticus 20:15,Kedoshim,"And if a man lie with a beast, he shall {{c1::surely}} be put to death; and ye shall slay the beast.",Torah::Leviticus::Kedoshim Type::AutoCloze
JPS1917|Leviticus 20:16|c1,Leviticus 20:16,Kedoshim,"And if a woman {{c1::approach}} unto any beast, and lie down thereto, thou shalt kill the woman, and the beast: they shall surely be put to death; their blood shall be upon them.",Torah::Leviticus::Kedoshim Type::AutoCloze
JPS1917|Leviticus 20:16|c2,Leviticus 20:16,Kedoshim,"And if a woman approach unto any beast, and lie down {{c1::thereto}}, thou shalt kill the woman, and the beast: they shall surely be put to death; their blood shall be upon them.",Torah::Leviticus::Kedoshim Type::AutoCloze
JPS1917|Leviticus 20:17|c1,Leviticus 20:17,Kedoshim,"And if a man shall take his {{c1::sister}}, his father’s daughter, or his mother’s daughter, and see her nakedness, and she see his nakedness: it is a shameful thing; and they shall be cut off in the sight of the children of their people: he hath uncovered his sister’s nakedness; he shall bear his iniquity.",Torah::Leviticus::Kedoshim Type::AutoCloze
JPS1917|Leviticus 20:17|c2,Leviticus 20:17,Kedoshim,"And if a man shall take his sister, his {{c1::father’s}} daughter, or his mother’s daughter, and see her nakedness, and she see his nakedness: it is a shameful thing; and they shall be cut off in the sight of the children of their people: he hath uncovered his sister’s nakedness; he shall bear his iniquity.",Torah::Leviticus::Kedoshim Type::AutoCloze
