JPS1917|Deuteronomy 6:20|c1,Deuteronomy 6:20,Vaetchanan,"When thy son asketh thee in time to come, saying: ‘{{c1::What}} mean the testimonies, and the statutes, and the ordinances, which the LORD our God hath commanded you?",Torah::Deuteronomy::Vaetchanan Type::AutoCloze
JPS1917|Deuteronomy 6:20|c2,Deuteronomy 6:20,Vaetchanan,"When thy son {{c1::asketh}} thee in time to come, saying: ‘What mean the testimonies, and the statutes, and the ordinances, which the LORD our God hath commanded you?",Torah::Deuteronomy::Vaetchanan Type::AutoCloze
JPS1917|Deuteronomy 6:21|c1,Deuteronomy 6:21,Vaetchanan,then thou shalt say unto thy son: ‘{{c1::We}} were Pharaoh’s bondmen in Egypt; and the LORD brought us out of Egypt with a mighty hand.,Torah::Deuteronomy::Vaetchanan Type::AutoCloze
JPS1917|Deuteronomy 6:21|c2,Deuteronomy 6:21,Vaetchanan,then thou shalt say unto thy son: ‘We were {{c1::Pharaoh’s}} bondmen in Egypt; and the LORD brought us out of Egypt with a mighty hand.,Torah::Deuteronomy::Vaetchanan Type::AutoCloze
JPS1917|Deuteronomy 6:22|c1,Deuteronomy 6:22,Vaetchanan,"And the LORD showed signs and wonders, great and sore, upon {{c1::Egypt}}, upon Pharaoh, and upon all his house, before our eyes.",Torah::Deuteronomy::Vaetchanan Type::AutoCloze
JPS1917|Deuteronomy 6:22|c2,Deuteronomy 6:22,Vaetchanan,"And the LORD showed signs and wonders, great and sore, upon Egypt, upon {{c1::Pharaoh}}, and upon all his house, before our eyes.",Torah::Deuteronomy::Vaetchanan Type::AutoCloze
JPS1917|Deuteronomy 6:23|c1,Deuteronomy 6:23,Vaetchanan,"And {{c1::He}} brought us out from thence, that He might bring us in, to give us the land which He swore unto our fathers.",Torah::Deuteronomy::Vaetchanan Type::AutoCloze
JPS1917|Deuteronomy 6:23|c2,Deuteronomy 6:23,Vaetchanan,"And He {{c1::brought}} us out from thence, that He might bring us in, to give us the land which He swore unto our fathers.",Torah::Deuteronomy::Vaetchanan Type::AutoCloze
JPS1917|Deuteronomy 6:24|c1,Deuteronomy 6:24,Vaetchanan,"And the LORD commanded us to do all these statutes, to fear the LORD our God, for our good always, that {{c1::He}} might preserve us alive, as it is at this day.",Torah::Deuteronomy::Vaetchanan Type::AutoCloze
JPS1917|Deuteronomy 6:24|c2,Deuteronomy 6:24,Vaetchanan,"And the LORD {{c1::commanded}} us to do all these statutes, to fear the LORD our God, for our good always, that He might preserve us alive, as it is at this day.",Torah::Deuteronomy::Vaetchanan Type::AutoCloze
JPS1917|Deuteronomy 6:25|c1,Deuteronomy 6:25,Vaetchanan,"And it shall be righteousness unto us, if we observe to do all this commandment before the LORD our God, as {{c1::He}} hath commanded us.’",Torah::Deuteronomy::Vaetchanan Type::AutoCloze
JPS1917|Deuteronomy 6:25|c2,Deuteronomy 6:25,Vaetchanan,"And it shall be {{c1::righteousness}} unto us, if we observe to do all this commandment before the LORD our God, as He hath commanded us.’",Torah::Deuteronomy::Vaetchanan Type::AutoCloze
JPS1917|Deuteronomy 7:1|c1,Deuteronomy 7:1,Vaetchanan,"When the LORD thy God shall bring thee into the land whither thou goest to possess it, and shall cast out many nations before thee, the {{c1::Hittite}}, and the Girgashite, and the Amorite, and the Canaanite, and the Perizzite, and the Hivite, and the Jebusite, seven nations greater and mightier than thou;",Torah::Deuteronomy::Vaetchanan Type::AutoCloze
JPS1917|Deuteronomy 7:1|c2,Deuteronomy 7:1,Vaetchanan,"When the LORD thy God shall bring thee into the land whither thou goest to possess it, and shall cast out many nations before thee, the Hittite, and the {{c1::Girgashite}}, and the Amorite, and the Canaanite, and the Perizzite, and the Hivite, and the Jebusite, seven nations greater and mightier than thou;",Torah::Deuteronomy::Vaetchanan Type::AutoCloze
JPS1917|Deuteronomy 7:2|c1,Deuteronomy 7:2,Vaetchanan,"and when the LORD thy God shall {{c1::deliver}} them up before thee, and thou shalt smite them; then thou shalt utterly destroy them; thou shalt make no covenant with them, nor show mercy unto them;",Torah::Deuteronomy::Vaetchanan Type::AutoCloze
JPS1917|Deuteronomy 7:2|c2,Deuteronomy 7:2,Vaetchanan,"and when the LORD thy God shall deliver them up {{c1::before}} thee, and thou shalt smite them; then thou shalt utterly destroy them; thou shalt make no covenant with them, nor show mercy unto them;",Torah::Deuteronomy::Vaetchanan Type::AutoCloze
JPS1917|Deuteronomy 7:3|c1,Deuteronomy 7:3,Vaetchanan,"{{c1::neither}} shalt thou make marriages with them: thy daughter thou shalt not give unto his son, nor his daughter shalt thou take unto thy son.",Torah::Deuteronomy::Vaetchanan Type::AutoCloze
JPS1917|Deuteronomy 7:3|c2,Deuteronomy 7:3,Vaetchanan,"neither shalt thou make {{c1::marriages}} with them: thy daughter thou shalt not give unto his son, nor his daughter shalt thou take unto thy son.",Torah::Deuteronomy::Vaetchanan Type::AutoCloze
JPS1917|Deuteronomy 7:4|c1,Deuteronomy 7:4,Vaetchanan,"For he will turn away thy son from following {{c1::Me}}, that they may serve other gods; so will the anger of the LORD be kindled against you, and He will destroy thee quickly.",Torah::Deuteronomy::Vaetchanan Type::AutoCloze
JPS1917|Deuteronomy 7:4|c2,Deuteronomy 7:4,Vaetchanan,"For he will turn away thy son from following Me, that they may serve other gods; so will the anger of the LORD be kindled against you, and {{c1::He}} will destroy thee quickly.",Torah::Deuteronomy::Vaetchanan Type::AutoCloze
JPS1917|Deuteronomy 7:5|c1,Deuteronomy 7:5,Vaetchanan,"But thus shall ye deal with them: ye shall break down their altars, and dash in pieces their pillars, and hew down their {{c1::Asherim}}, and burn their graven images with fire.",Torah::Deuteronomy::Vaetchanan Type::AutoCloze
JPS1917|Deuteronomy 7:5|c2,Deuteronomy 7:5,Vaetchanan,"But thus shall ye deal with them: ye shall break down their {{c1::altars}}, and dash in pieces their pillars, and hew down their Asherim, and burn their graven images with fire.",Torah::Deuteronomy::Vaetchanan Type::AutoCloze
JPS1917|Deuteronomy 7:6|c1,Deuteronomy 7:6,Vaetchanan,"For thou art a holy {{c1::people}} unto the LORD thy God: the LORD thy God hath chosen thee to be His own treasure, out of all peoples that are upon the face of the earth.",Torah::Deuteronomy::Vaetchanan Type::AutoCloze
JPS1917|Deuteronomy 7:6|c2,Deuteronomy 7:6,Vaetchanan,"For thou art a holy people unto the LORD thy God: the LORD thy God hath {{c1::chosen}} thee to be His own treasure, out of all peoples that are upon the face of the earth.",Torah::Deuteronomy::Vaetchanan Type::AutoCloze
JPS1917|Deuteronomy 7:7|c1,Deuteronomy 7:7,Vaetchanan,"The LORD did not set His love upon you, nor {{c1::choose}} you, because ye were more in number than any people—for ye were the fewest of all peoples—",Torah::Deuteronomy::Vaetchanan Type::AutoCloze
JPS1917|Deuteronomy 7:7|c2,Deuteronomy 7:7,Vaetchanan,"The LORD did not set His love upon you, nor choose you, {{c1::because}} ye were more in number than any people—for ye were the fewest of all peoples—",Torah::Deuteronomy::Vaetchanan Type::AutoCloze
JPS1917|Deuteronomy 7:8|c1,Deuteronomy 7:8,Vaetchanan,"but because the LORD loved you, and because {{c1::He}} would keep the oath which He swore unto your fathers, hath the LORD brought you out with a mighty hand, and redeemed you out of the house of bondage, from the hand of Pharaoh king of Egypt.",Torah::Deuteronomy::Vaetchanan Type::AutoCloze
JPS1917|Deuteronomy 7:8|c2,Deuteronomy 7:8,Vaetchanan,"but because the LORD loved you, and because He would keep the oath which He swore unto your fathers, hath the LORD brought you out with a mighty hand, and redeemed you out of the house of bondage, from the hand of {{c1::Pharaoh}} king of Egypt.",Torah::Deuteronomy::Vaetchanan Type::AutoCloze
JPS1917|Deuteronomy 7:9|c1,Deuteronomy 7:9,Vaetchanan,"Know therefore that the LORD thy God, {{c1::He}} is God; the faithful God, who keepeth covenant and mercy with them that love Him and keep His commandments to a thousand generations;",Torah::Deuteronomy::Vaetchanan Type::AutoCloze
JPS1917|Deuteronomy 7:9|c2,Deuteronomy 7:9,Vaetchanan,"Know {{c1::therefore}} that the LORD thy God, He is God; the faithful God, who keepeth covenant and mercy with them that love Him and keep His commandments to a thousand generations;",Torah::Deuteronomy::Vaetchanan Type::AutoCloze
JPS1917|Deuteronomy 7:10|c1,Deuteronomy 7:10,Vaetchanan,"and repayeth them that hate Him to their face, to destroy them; {{c1::He}} will not be slack to him that hateth Him, He will repay him to his face.",Torah::Deuteronomy::Vaetchanan Type::AutoCloze
JPS1917|Deuteronomy 7:10|c2,Deuteronomy 7:10,Vaetchanan,"and {{c1::repayeth}} them that hate Him to their face, to destroy them; He will not be slack to him that hateth Him, He will repay him to his face.",Torah::Deuteronomy::Vaetchanan Type::AutoCloze
JPS1917|Deuteronomy 7:11|c1,Deuteronomy 7:11,Vaetchanan,"Thou shalt therefore keep the commandment, and the statutes, and the ordinances, which {{c1::I}} command thee this day, to do them.",Torah::Deuteronomy::Vaetchanan Type::AutoCloze
JPS1917|Deuteronomy 7:11|c2,Deuteronomy 7:11,Vaetchanan,"Thou shalt {{c1::therefore}} keep the commandment, and the statutes, and the ordinances, which I command thee this day, to do them.",Torah::Deuteronomy::Vaetchanan Type::AutoCloze
