JPS1917|Genesis 44:18|c1,Genesis 44:18,Vayigash,"Then {{c1::Judah}} came near unto him, and said: ‘Oh my lord, let thy servant, I pray thee, speak a word in my lord’s ears, and let not thine anger burn against thy servant; for thou art even as Pharaoh.",Torah::Genesis::Vayigash Type::AutoCloze
JPS1917|Genesis 44:18|c2,Genesis 44:18,Vayigash,"Then Judah came near unto him, and said: ‘{{c1::Oh}} my lord, let thy servant, I pray thee, speak a word in my lord’s ears, and let not thine anger burn against thy servant; for thou art even as Pharaoh.",Torah::Genesis::Vayigash Type::AutoCloze
JPS1917|Genesis 44:19|c1,Genesis 44:19,Vayigash,"My lord asked his servants, saying: {{c1::Have}} ye a father, or a brother?",Torah::Genesis::Vayigash Type::AutoCloze
JPS1917|Genesis 44:19|c2,Genesis 44:19,Vayigash,"My lord asked his {{c1::servants}}, saying: Have ye a father, or a brother?",Torah::Genesis::Vayigash Type::AutoCloze
JPS1917|Genesis 44:20|c1,Genesis 44:20,Vayigash,"And we said unto my lord: {{c1::We}} have a father, an old man, and a child of his old age, a little one; and his brother is dead, and he alone is left of his mother, and his father loveth him.",Torah::Genesis::Vayigash Type::AutoCloze
JPS1917|Genesis 44:20|c2,Genesis 44:20,Vayigash,"And we said unto my lord: We have a {{c1::father}}, an old man, and a child of his old age, a little one; and his brother is dead, and he alone is left of his mother, and his father loveth him.",Torah::Genesis::Vayigash Type::AutoCloze
JPS1917|Genesis 44:21|c1,Genesis 44:21,Vayigash,"And thou saidst unto thy servants: {{c1::Bring}} him down unto me, that I may set mine eyes upon him.",Torah::Genesis::Vayigash Type::AutoCloze
JPS1917|Genesis 44:21|c2,Genesis 44:21,Vayigash,"And thou saidst unto thy servants: Bring him down unto me, that {{c1::I}} may set mine eyes upon him.",Torah::Genesis::Vayigash Type::AutoCloze
JPS1917|Genesis 44:22|c1,Genesis 44:22,Vayigash,"And we said unto my lord: The lad {{c1::cannot}} leave his father; for if he should leave his father, his father would die.",Torah::Genesis::Vayigash Type::AutoCloze
JPS1917|Genesis 44:22|c2,Genesis 44:22,Vayigash,"And we said unto my lord: The lad cannot leave his {{c1::father}}; for if he should leave his father, his father would die.",Torah::Genesis::Vayigash Type::AutoCloze
JPS1917|Genesis 44:23|c1,Genesis 44:23,Vayigash,"And thou saidst unto thy servants: {{c1::Except}} your youngest brother come down with you, ye shall see my face no more.",Torah::Genesis::Vayigash Type::AutoCloze
JPS1917|Genesis 44:23|c2,Genesis 44:23,Vayigash,"And thou {{c1::saidst}} unto thy servants: Except your youngest brother come down with you, ye shall see my face no more.",Torah::Genesis::Vayigash Type::AutoCloze
JPS1917|Genesis 44:24|c1,Genesis 44:24,Vayigash,"And it came to pass when we came up unto thy {{c1::servant}} my father, we told him the words of my lord.",Torah::Genesis::Vayigash Type::AutoCloze
JPS1917|Genesis 44:24|c2,Genesis 44:24,Vayigash,"And it came to pass when we came up unto thy servant my {{c1::father}}, we told him the words of my lord.",Torah::Genesis::Vayigash Type::AutoCloze
JPS1917|Genesis 44:25|c1,Genesis 44:25,Vayigash,"And our father said: {{c1::Go}} again, buy us a little food.",Torah::Genesis::Vayigash Type::AutoCloze
JPS1917|Genesis 44:25|c2,Genesis 44:25,Vayigash,"And our {{c1::father}} said: Go again, buy us a little food.",Torah::Genesis::Vayigash Type::AutoCloze
JPS1917|Genesis 44:26|c1,Genesis 44:26,Vayigash,"And we said: {{c1::We}} cannot go down; if our youngest brother be with us, then will we go down; for we may not see the man’s face, except our youngest brother be with us.",Torah::Genesis::Vayigash Type::AutoCloze
JPS1917|Genesis 44:26|c2,Genesis 44:26,Vayigash,"And we said: We {{c1::cannot}} go down; if our youngest brother be with us, then will we go down; for we may not see the man’s face, except our youngest brother be with us.",Torah::Genesis::Vayigash Type::AutoCloze
JPS1917|Genesis 44:27|c1,Genesis 44:27,Vayigash,And thy servant my father said unto us: {{c1::Ye}} know that my wife bore me two sons;,Torah::Genesis::Vayigash Type::AutoCloze
JPS1917|Genesis 44:27|c2,Genesis 44:27,Vayigash,And thy {{c1::servant}} my father said unto us: Ye know that my wife bore me two sons;,Torah::Genesis::Vayigash Type::AutoCloze
JPS1917|Genesis 44:28|c1,Genesis 44:28,Vayigash,"and the one went out from me, and {{c1::I}} said: Surely he is torn in pieces; and I have not seen him since;",Torah::Genesis::Vayigash Type::AutoCloze
JPS1917|Genesis 44:28|c2,Genesis 44:28,Vayigash,"and the one went out from me, and I said: {{c1::Surely}} he is torn in pieces; and I have not seen him since;",Torah::Genesis::Vayigash Type::AutoCloze
JPS1917|Genesis 44:29|c1,Genesis 44:29,Vayigash,"and if ye take this one also from me, and harm {{c1::befall}} him, ye will bring down my gray hairs with sorrow to the grave.",Torah::Genesis::Vayigash Type::AutoCloze
JPS1917|Genesis 44:29|c2,Genesis 44:29,Vayigash,"and if ye take this one also from me, and harm befall him, ye will bring down my gray hairs with {{c1::sorrow}} to the grave.",Torah::Genesis::Vayigash Type::AutoCloze
JPS1917|Genesis 44:30|c1,Genesis 44:30,Vayigash,"Now therefore when {{c1::I}} come to thy servant my father, and the lad is not with us; seeing that his soul is bound up with the lad’s soul;",Torah::Genesis::Vayigash Type::AutoCloze
JPS1917|Genesis 44:30|c2,Genesis 44:30,Vayigash,"Now {{c1::therefore}} when I come to thy servant my father, and the lad is not with us; seeing that his soul is bound up with the lad’s soul;",Torah::Genesis::Vayigash Type::AutoCloze
JPS1917|Genesis 44:31|c1,Genesis 44:31,Vayigash,"it will come to pass, when he seeth that the lad is not with us, that he will die; and thy {{c1::servants}} will bring down the gray hairs of thy servant our father with sorrow to the grave.",Torah::Genesis::Vayigash Type::AutoCloze
JPS1917|Genesis 44:31|c2,Genesis 44:31,Vayigash,"it will come to pass, when he seeth that the lad is not with us, that he will die; and thy servants will bring down the gray hairs of thy {{c1::servant}} our father with sorrow to the grave.",Torah::Genesis::Vayigash Type::AutoCloze
JPS1917|Genesis 44:32|c1,Genesis 44:32,Vayigash,"For thy servant became surety for the lad unto my father, saying: {{c1::If}} I bring him not unto thee, then shall I bear the blame to my father for ever.",Torah::Genesis::Vayigash Type::AutoCloze
JPS1917|Genesis 44:32|c2,Genesis 44:32,Vayigash,"For thy servant became surety for the lad unto my father, saying: If {{c1::I}} bring him not unto thee, then shall I bear the blame to my father for ever.",Torah::Genesis::Vayigash Type::AutoCloze
JPS1917|Genesis 44:33|c1,Genesis 44:33,Vayigash,"Now therefore, let thy servant, {{c1::I}} pray thee, abide instead of the lad a bondman to my lord; and let the lad go up with his brethren.",Torah::Genesis::Vayigash Type::AutoCloze
JPS1917|Genesis 44:33|c2,Genesis 44:33,Vayigash,"Now {{c1::therefore}}, let thy servant, I pray thee, abide instead of the lad a bondman to my lord; and let the lad go up with his brethren.",Torah::Genesis::Vayigash Type::AutoCloze
JPS1917|Genesis 44:34|c1,Genesis 44:34,Vayigash,"For how shall {{c1::I}} go up to my father, if the lad be not with me? lest I look upon the evil that shall come on my father.’",Torah::Genesis::Vayigash Type::AutoCloze
JPS1917|Genesis 44:34|c2,Genesis 44:34,Vayigash,"For how shall I go up to my {{c1::father}}, if the lad be not with me? lest I look upon the evil that shall come on my father.’",Torah::Genesis::Vayigash Type::AutoCloze
JPS1917|Genesis 45:1|c1,Genesis 45:1,Vayigash,"Then {{c1::Joseph}} could not refrain himself before all them that stood by him; and he cried: ‘Cause every man to go out from me.’ And there stood no man with him, while Joseph made himself known unto his brethren.",Torah::Genesis::Vayigash Type::AutoCloze
JPS1917|Genesis 45:1|c2,Genesis 45:1,Vayigash,"Then Joseph could not refrain himself before all them that stood by him; and he cried: ‘{{c1::Cause}} every man to go out from me.’ And there stood no man with him, while Joseph made himself known unto his brethren.",Torah::Genesis::Vayigash Type::AutoCloze
JPS1917|Genesis 45:2|c1,Genesis 45:2,Vayigash,"And he wept aloud; and the {{c1::Egyptians}} heard, and the house of Pharaoh heard.",Torah::Genesis::Vayigash Type::AutoCloze
JPS1917|Genesis 45:2|c2,Genesis 45:2,Vayigash,"And he wept aloud; and the Egyptians heard, and the house of {{c1::Pharaoh}} heard.",Torah::Genesis::Vayigash Type::AutoCloze
JPS1917|Genesis 45:3|c1,Genesis 45:3,Vayigash,And {{c1::Joseph}} said unto his brethren: ‘I am Joseph; doth my father yet live?’ And his brethren could not answer him; for they were affrighted at his presence.,Torah::Genesis::Vayigash Type::AutoCloze
JPS1917|Genesis 45:3|c2,Genesis 45:3,Vayigash,And Joseph said unto his brethren: ‘{{c1::I}} am Joseph; doth my father yet live?’ And his brethren could not answer him; for they were affrighted at his presence.,Torah::Genesis::Vayigash Type::AutoCloze
JPS1917|Genesis 45:4|c1,Genesis 45:4,Vayigash,"And {{c1::Joseph}} said unto his brethren: ‘Come near to me, I pray you.’ And they came near. And he said: ‘I am Joseph your brother, whom ye sold into Egypt.",Torah::Genesis::Vayigash Type::AutoCloze
JPS1917|Genesis 45:4|c2,Genesis 45:4,Vayigash,"And Joseph said unto his brethren: ‘{{c1::Come}} near to me, I pray you.’ And they came near. And he said: ‘I am Joseph your brother, whom ye sold into Egypt.",Torah::Genesis::Vayigash Type::AutoCloze
JPS1917|Genesis 45:5|c1,Genesis 45:5,Vayigash,"And now be not {{c1::grieved}}, nor angry with yourselves, that ye sold me hither; for God did send me before you to preserve life.",Torah::Genesis::Vayigash Type::AutoCloze
JPS1917|Genesis 45:5|c2,Genesis 45:5,Vayigash,"And now be not grieved, nor angry with {{c1::yourselves}}, that ye sold me hither; for God did send me before you to preserve life.",Torah::Genesis::Vayigash Type::AutoCloze
JPS1917|Genesis 45:6|c1,Genesis 45:6,Vayigash,"For these two years hath the {{c1::famine}} been in the land; and there are yet five years, in which there shall be neither plowing nor harvest.",Torah::Genesis::Vayigash Type::AutoCloze
JPS1917|Genesis 45:6|c2,Genesis 45:6,Vayigash,"For these two years hath the famine been in the land; and there are yet five years, in which there shall be {{c1::neither}} plowing nor harvest.",Torah::Genesis::Vayigash Type::AutoCloze
JPS1917|Genesis 45:7|c1,Genesis 45:7,Vayigash,"And God sent me {{c1::before}} you to give you a remnant on the earth, and to save you alive for a great deliverance.",Torah::Genesis::Vayigash Type::AutoCloze
JPS1917|Genesis 45:7|c2,Genesis 45:7,Vayigash,"And God sent me before you to give you a {{c1::remnant}} on the earth, and to save you alive for a great deliverance.",Torah::Genesis::Vayigash Type::AutoCloze
JPS1917|Genesis 45:8|c1,Genesis 45:8,Vayigash,"So now it was not you that sent me hither, but God; and {{c1::He}} hath made me a father to Pharaoh, and lord of all his house, and ruler over all the land of Egypt.",Torah::Genesis::Vayigash Type::AutoCloze
JPS1917|Genesis 45:8|c2,Genesis 45:8,Vayigash,"So now it was not you that sent me hither, but God; and He hath made me a father to {{c1::Pharaoh}}, and lord of all his house, and ruler over all the land of Egypt.",Torah::Genesis::Vayigash Type::AutoCloze
JPS1917|Genesis 45:9|c1,Genesis 45:9,Vayigash,"Hasten ye, and go up to my father, and say unto him: {{c1::Thus}} saith thy son Joseph: God hath made me lord of all Egypt; come down unto me, tarry not.",Torah::Genesis::Vayigash Type::AutoCloze
JPS1917|Genesis 45:9|c2,Genesis 45:9,Vayigash,"Hasten ye, and go up to my father, and say unto him: Thus saith thy son {{c1::Joseph}}: God hath made me lord of all Egypt; come down unto me, tarry not.",Torah::Genesis::Vayigash Type::AutoCloze
JPS1917|Genesis 45:10|c1,Genesis 45:10,Vayigash,"And thou shalt dwell in the land of {{c1::Goshen}}, and thou shalt be near unto me, thou, and thy children, and thy children’s children, and thy flocks, and thy herds, and all that thou hast;",Torah::Genesis::Vayigash Type::AutoCloze
JPS1917|Genesis 45:10|c2,Genesis 45:10,Vayigash,"And thou shalt dwell in the land of Goshen, and thou shalt be near unto me, thou, and thy {{c1::children}}, and thy children’s children, and thy flocks, and thy herds, and all that thou hast;",Torah::Genesis::Vayigash Type::AutoCloze
JPS1917|Genesis 45:11|c1,Genesis 45:11,Vayigash,"and there will {{c1::I}} sustain thee; for there are yet five years of famine; lest thou come to poverty, thou, and thy household, and all that thou hast.",Torah::Genesis::Vayigash Type::AutoCloze
JPS1917|Genesis 45:11|c2,Genesis 45:11,Vayigash,"and there will I {{c1::sustain}} thee; for there are yet five years of famine; lest thou come to poverty, thou, and thy household, and all that thou hast.",Torah::Genesis::Vayigash Type::AutoCloze
JPS1917|Genesis 45:12|c1,Genesis 45:12,Vayigash,"And, behold, your eyes see, and the eyes of my brother {{c1::Benjamin}}, that it is my mouth that speaketh unto you.",Torah::Genesis::Vayigash Type::AutoCloze
JPS1917|Genesis 45:12|c2,Genesis 45:12,Vayigash,"And, {{c1::behold}}, your eyes see, and the eyes of my brother Benjamin, that it is my mouth that speaketh unto you.",Torah::Genesis::Vayigash Type::AutoCloze
JPS1917|Genesis 45:13|c1,Genesis 45:13,Vayigash,"And ye shall tell my father of all my glory in {{c1::Egypt}}, and of all that ye have seen; and ye shall hasten and bring down my father hither.’",Torah::Genesis::Vayigash Type::AutoCloze
JPS1917|Genesis 45:13|c2,Genesis 45:13,Vayigash,"And ye shall tell my {{c1::father}} of all my glory in Egypt, and of all that ye have seen; and ye shall hasten and bring down my father hither.’",Torah::Genesis::Vayigash Type::AutoCloze
JPS1917|Genesis 45:14|c1,Genesis 45:14,Vayigash,"And he fell upon his brother {{c1::Benjamin’s}} neck, and wept; and Benjamin wept upon his neck.",Torah::Genesis::Vayigash Type::AutoCloze
JPS1917|Genesis 45:14|c2,Genesis 45:14,Vayigash,"And he fell upon his brother {{c1::Benjamin}}’s neck, and wept; and Benjamin wept upon his neck.",Torah::Genesis::Vayigash Type::AutoCloze
JPS1917|Genesis 45:15|c1,Genesis 45:15,Vayigash,"And he {{c1::kissed}} all his brethren, and wept upon them; and after that his brethren talked with him.",Torah::Genesis::Vayigash Type::AutoCloze
JPS1917|Genesis 45:15|c2,Genesis 45:15,Vayigash,"And he kissed all his {{c1::brethren}}, and wept upon them; and after that his brethren talked with him.",Torah::Genesis::Vayigash Type::AutoCloze
JPS1917|Genesis 45:16|c1,Genesis 45:16,Vayigash,"And the report thereof was heard in {{c1::Pharaoh’s}} house, saying: ‘Joseph’s brethren are come’; and it pleased Pharaoh well, and his servants.",Torah::Genesis::Vayigash Type::AutoCloze
JPS1917|Genesis 45:16|c2,Genesis 45:16,Vayigash,"And the report thereof was heard in Pharaoh’s house, saying: ‘{{c1::Joseph’s}} brethren are come’; and it pleased Pharaoh well, and his servants.",Torah::Genesis::Vayigash Type::AutoCloze
JPS1917|Genesis 45:17|c1,Genesis 45:17,Vayigash,"And {{c1::Pharaoh}} said unto Joseph: ‘Say unto thy brethren: This do ye: lade your beasts, and go, get you unto the land of Canaan;",Torah::Genesis::Vayigash Type::AutoCloze
JPS1917|Genesis 45:17|c2,Genesis 45:17,Vayigash,"And Pharaoh said unto {{c1::Joseph}}: ‘Say unto thy brethren: This do ye: lade your beasts, and go, get you unto the land of Canaan;",Torah::Genesis::Vayigash Type::AutoCloze
JPS1917|Genesis 45:18|c1,Genesis 45:18,Vayigash,"and take your father and your households, and come unto me; and {{c1::I}} will give you the good of the land of Egypt, and ye shall eat the fat of the land.",Torah::Genesis::Vayigash Type::AutoCloze
JPS1917|Genesis 45:18|c2,Genesis 45:18,Vayigash,"and take your father and your households, and come unto me; and I will give you the good of the land of {{c1::Egypt}}, and ye shall eat the fat of the land.",Torah::Genesis::Vayigash Type::AutoCloze
JPS1917|Genesis 45:19|c1,Genesis 45:19,Vayigash,"Now thou art commanded, this do ye: take you wagons out of the land of {{c1::Egypt}} for your little ones, and for your wives, and bring your father, and come.",Torah::Genesis::Vayigash Type::AutoCloze
JPS1917|Genesis 45:19|c2,Genesis 45:19,Vayigash,"Now thou art {{c1::commanded}}, this do ye: take you wagons out of the land of Egypt for your little ones, and for your wives, and bring your father, and come.",Torah::Genesis::Vayigash Type::AutoCloze
JPS1917|Genesis 45:20|c1,Genesis 45:20,Vayigash,Also regard not your stuff; for the good things of all the land of {{c1::Egypt}} are yours.’,Torah::Genesis::Vayigash Type::AutoCloze
JPS1917|Genesis 45:20|c2,Genesis 45:20,Vayigash,Also {{c1::regard}} not your stuff; for the good things of all the land of Egypt are yours.’,Torah::Genesis::Vayigash Type::AutoCloze
JPS1917|Genesis 45:21|c1,Genesis 45:21,Vayigash,"And the sons of {{c1::Israel}} did so; and Joseph gave them wagons, according to the commandment of Pharaoh, and gave them provision for the way.",Torah::Genesis::Vayigash Type::AutoCloze
JPS1917|Genesis 45:21|c2,Genesis 45:21,Vayigash,"And the sons of Israel did so; and {{c1::Joseph}} gave them wagons, according to the commandment of Pharaoh, and gave them provision for the way.",Torah::Genesis::Vayigash Type::AutoCloze
JPS1917|Genesis 45:22|c1,Genesis 45:22,Vayigash,"To all of them he gave each man changes of raiment; but to {{c1::Benjamin}} he gave three hundred shekels of silver, and five changes of raiment.",Torah::Genesis::Vayigash Type::AutoCloze
JPS1917|Genesis 45:22|c2,Genesis 45:22,Vayigash,"To all of them he gave each man {{c1::changes}} of raiment; but to Benjamin he gave three hundred shekels of silver, and five changes of raiment.",Torah::Genesis::Vayigash Type::AutoCloze
JPS1917|Genesis 45:23|c1,Genesis 45:23,Vayigash,"And to his father he sent in like manner ten asses laden with the good things of {{c1::Egypt}}, and ten she-asses laden with corn and bread and victual for his father by the way.",Torah::Genesis::Vayigash Type::AutoCloze
JPS1917|Genesis 45:23|c2,Genesis 45:23,Vayigash,"And to his {{c1::father}} he sent in like manner ten asses laden with the good things of Egypt, and ten she-asses laden with corn and bread and victual for his father by the way.",Torah::Genesis::Vayigash Type::AutoCloze
JPS1917|Genesis 45:24|c1,Genesis 45:24,Vayigash,"So he sent his brethren away, and they departed; and he said unto them: ‘{{c1::See}} that ye fall not out by the way.’",Torah::Genesis::Vayigash Type::AutoCloze
JPS1917|Genesis 45:24|c2,Genesis 45:24,Vayigash,"So he sent his {{c1::brethren}} away, and they departed; and he said unto them: ‘See that ye fall not out by the way.’",Torah::Genesis::Vayigash Type::AutoCloze
JPS1917|Genesis 45:25|c1,Genesis 45:25,Vayigash,"And they went up out of {{c1::Egypt}}, and came into the land of Canaan unto Jacob their father.",Torah::Genesis::Vayigash Type::AutoCloze
JPS1917|Genesis 45:25|c2,Genesis 45:25,Vayigash,"And they went up out of Egypt, and came into the land of {{c1::Canaan}} unto Jacob their father.",Torah::Genesis::Vayigash Type::AutoCloze
JPS1917|Genesis 45:26|c1,Genesis 45:26,Vayigash,"And they told him, saying: ‘{{c1::Joseph}} is yet alive, and he is ruler over all the land of Egypt.’ And his heart fainted, for he believed them not.",Torah::Genesis::Vayigash Type::AutoCloze
JPS1917|Genesis 45:26|c2,Genesis 45:26,Vayigash,"And they told him, saying: ‘Joseph is yet alive, and he is ruler over all the land of {{c1::Egypt}}.’ And his heart fainted, for he believed them not.",Torah::Genesis::Vayigash Type::AutoCloze
JPS1917|Genesis 45:27|c1,Genesis 45:27,Vayigash,"And they told him all the words of {{c1::Joseph}}, which he had said unto them; and when he saw the wagons which Joseph had sent to carry him, the spirit of Jacob their father revived.",Torah::Genesis::Vayigash Type::AutoCloze
JPS1917|Genesis 45:27|c2,Genesis 45:27,Vayigash,"And they told him all the words of Joseph, which he had said unto them; and when he saw the wagons which Joseph had sent to carry him, the spirit of {{c1::Jacob}} their father revived.",Torah::Genesis::Vayigash Type::AutoCloze
JPS1917|Genesis 45:28|c1,Genesis 45:28,Vayigash,And {{c1::Israel}} said: ‘It is enough; Joseph my son is yet alive; I will go and see him before I die.’,Torah::Genesis::Vayigash Type::AutoCloze
JPS1917|Genesis 45:28|c2,Genesis 45:28,Vayigash,And Israel said: ‘{{c1::It}} is enough; Joseph my son is yet alive; I will go and see him before I die.’,Torah::Genesis::Vayigash Type::AutoCloze
JPS1917|Genesis 46:1|c1,Genesis 46:1,Vayigash,"And {{c1::Israel}} took his journey with all that he had, and came to Beer-sheba, and offered sacrifices unto the God of his father Isaac.",Torah::Genesis::Vayigash Type::AutoCloze
JPS1917|Genesis 46:1|c2,Genesis 46:1,Vayigash,"And Israel took his journey with all that he had, and came to {{c1::Beer}}-sheba, and offered sacrifices unto the God of his father Isaac.",Torah::Genesis::Vayigash Type::AutoCloze
JPS1917|Genesis 46:2|c1,Genesis 46:2,Vayigash,"And God spoke unto {{c1::Israel}} in the visions of the night, and said: ‘Jacob, Jacob.’ And he said: ‘Here am I.’",Torah::Genesis::Vayigash Type::AutoCloze
JPS1917|Genesis 46:2|c2,Genesis 46:2,Vayigash,"And God spoke unto Israel in the visions of the night, and said: ‘{{c1::Jacob}}, Jacob.’ And he said: ‘Here am I.’",Torah::Genesis::Vayigash Type::AutoCloze
JPS1917|Genesis 46:3|c1,Genesis 46:3,Vayigash,"And {{c1::He}} said: ‘I am God, the God of thy father; fear not to go down into Egypt; for I will there make of thee a great nation.",Torah::Genesis::Vayigash Type::AutoCloze
JPS1917|Genesis 46:3|c2,Genesis 46:3,Vayigash,"And He said: ‘{{c1::I}} am God, the God of thy father; fear not to go down into Egypt; for I will there make of thee a great nation.",Torah::Genesis::Vayigash Type::AutoCloze
JPS1917|Genesis 46:4|c1,Genesis 46:4,Vayigash,I will go down with thee into {{c1::Egypt}}; and I will also surely bring thee up again; and Joseph shall put his hand upon thine eyes.’,Torah::Genesis::Vayigash Type::AutoCloze
JPS1917|Genesis 46:4|c2,Genesis 46:4,Vayigash,I will go down with thee into Egypt; and I will also surely bring thee up again; and {{c1::Joseph}} shall put his hand upon thine eyes.’,Torah::Genesis::Vayigash Type::AutoCloze
JPS1917|Genesis 46:5|c1,Genesis 46:5,Vayigash,"And {{c1::Jacob}} rose up from Beer-sheba; and the sons of Israel carried Jacob their father, and their little ones, and their wives, in the wagons which Pharaoh had sent to carry him.",Torah::Genesis::Vayigash Type::AutoCloze
JPS1917|Genesis 46:5|c2,Genesis 46:5,Vayigash,"And Jacob rose up from {{c1::Beer}}-sheba; and the sons of Israel carried Jacob their father, and their little ones, and their wives, in the wagons which Pharaoh had sent to carry him.",Torah::Genesis::Vayigash Type::AutoCloze
JPS1917|Genesis 46:6|c1,Genesis 46:6,Vayigash,"And they took their cattle, and their goods, which they had gotten in the land of {{c1::Canaan}}, and came into Egypt, Jacob, and all his seed with him;",Torah::Genesis::Vayigash Type::AutoCloze
JPS1917|Genesis 46:6|c2,Genesis 46:6,Vayigash,"And they took their cattle, and their goods, which they had gotten in the land of Canaan, and came into {{c1::Egypt}}, Jacob, and all his seed with him;",Torah::Genesis::Vayigash Type::AutoCloze
JPS1917|Genesis 46:7|c1,Genesis 46:7,Vayigash,"his sons, and his sons’sons with him, his daughters, and his sons’daughters, and all his seed brought he with him into {{c1::Egypt}}.",Torah::Genesis::Vayigash Type::AutoCloze
JPS1917|Genesis 46:7|c2,Genesis 46:7,Vayigash,"his sons, and his {{c1::sons’sons}} with him, his daughters, and his sons’daughters, and all his seed brought he with him into Egypt.",Torah::Genesis::Vayigash Type::AutoCloze
JPS1917|Genesis 46:8|c1,Genesis 46:8,Vayigash,"And these are the names of the children of {{c1::Israel}}, who came into Egypt, Jacob and his sons: Reuben, Jacob’s first-born.",Torah::Genesis::Vayigash Type::AutoCloze
JPS1917|Genesis 46:8|c2,Genesis 46:8,Vayigash,"And these are the names of the children of Israel, who came into {{c1::Egypt}}, Jacob and his sons: Reuben, Jacob’s first-born.",Torah::Genesis::Vayigash Type::AutoCloze
JPS1917|Genesis 46:9|c1,Genesis 46:9,Vayigash,"And the sons of {{c1::Reuben}}: Hanoch, and Pallu, and Hezron, and Carmi.",Torah::Genesis::Vayigash Type::AutoCloze
JPS1917|Genesis 46:9|c2,Genesis 46:9,Vayigash,"And the sons of Reuben: {{c1::Hanoch}}, and Pallu, and Hezron, and Carmi.",Torah::Genesis::Vayigash Type::AutoCloze
JPS1917|Genesis 46:10|c1,Genesis 46:10,Vayigash,"And the sons of {{c1::Simeon}}: Jemuel, and Jamin, and Ohad, and Jachin, and Zohar, and Shaul the son of a Canaanitish woman.",Torah::Genesis::Vayigash Type::AutoCloze
JPS1917|Genesis 46:10|c2,Genesis 46:10,Vayigash,"And the sons of Simeon: {{c1::Jemuel}}, and Jamin, and Ohad, and Jachin, and Zohar, and Shaul the son of a Canaanitish woman.",Torah::Genesis::Vayigash Type::AutoCloze
JPS1917|Genesis 46:11|c1,Genesis 46:11,Vayigash,"And the sons of {{c1::Levi}}: Gershon, Kohath, and Merari.",Torah::Genesis::Vayigash Type::AutoCloze
JPS1917|Genesis 46:11|c2,Genesis 46:11,Vayigash,"And the sons of Levi: {{c1::Gershon}}, Kohath, and Merari.",Torah::Genesis::Vayigash Type::AutoCloze
JPS1917|Genesis 46:12|c1,Genesis 46:12,Vayigash,"And the sons of {{c1::Judah}}: Er, and Onan, and Shelah, and Perez, and Zerah; but Er and Onan died in the land of Canaan. And the sons of Perez were Hezron and Hamul.",Torah::Genesis::Vayigash Type::AutoCloze
